ID Conferencia,Sigla,Ano Dados,Nome do evento,Siglas Alternativas,Nomes Alternativos,Sociedade,Avaliação SBC,SBC-CE,Origem Cadastro,Anais,SOL ID,GS ID,DBLP ID
CompID900466,GameSec,2025,Conference on Decision and Game Theory for Security,,,,,,Qualis 2017-2020,,,,
CompID900467,GAS,2025,International Workshop on Games and Software Engineering,,,,,,Qualis 2017-2020,,,,
CompID900468,GbRPR,2025,International Workshop on Graph-Based Representations in Pattern Recognition,,,,,,Qualis 2017-2020,,,,
CompID900469,GECCO,2025,Genetic and Evolutionary Computation Conference,,,,,,Qualis 2017-2020,,,,
CompID900470,GECON,2025,"International Conference on Economics of Grids, Clouds, Systems and Services",,,,,,Qualis 2017-2020,,,,
CompID900471,GEFI,2025,Global Experimentation for Future Internet,,,,,,Qualis 2017-2020,,,,
CompID900472,GEM,2025,"IEEE Games, Entertainment, Media Conference",,,,,,Qualis 2017-2020,,,,
CompID900473,GeoAI,2025,International Workshop on AI for Geographic Knowledge Discovery,,,,,,Qualis 2017-2020,,,,
CompID900474,GEOBIA,2025,Geographic Object-based Image Analysis,,,,,,Qualis 2017-2020,,,,
CompID900475,GEOINFO,2025,Brazilian Symposium on GeoInformatics,,,,,,Qualis 2017-2020,,,,
CompID900476,GeoPROCESSING-IARIA,2025,"IARIA International Conference on Advanced Geographic Information Systems, Applications, and Services",,,,,,Qualis 2017-2020,,,,
CompID900477,GeoSim,2025,International Workshop on Geospatial Simulation,,,,,,Qualis 2017-2020,,,,
CompID900478,GI,2025,Graphics Interface Conference,,,,,,Qualis 2017-2020,,,,
CompID900479,GIIS,2025,Global Information Infrastructure and Networking Symposium,,,,,,Qualis 2017-2020,,,,
CompID900480,GIR,2025,Workshop on Geographic Information Retrieval,,,,,,Qualis 2017-2020,,,,
CompID900481,GIScience,2025,International Conference on Geographic Information Science,,,,,,Qualis 2017-2020,,,,
CompID900482,GLOBALSIP,2025,Global Conference on Signal and Information Processing,,,,,,Qualis 2017-2020,,,,
CompID900483,GLOBECOM,2025,IEEE Global Communications Conference,,,,,,Qualis 2017-2020,,,,
CompID900484,GLSVLSI,2025,Great Lakes Symposium on VLSI,,,,,,Qualis 2017-2020,,,,
CompID900485,GPC,2025,International Conference on Grid And Pervasive Computing,,,,,,Qualis 2017-2020,,,,
CompID900486,GPCE,2025,ACM International Conference on Generative Programming: Concepts and Experiences,,,,,,Qualis 2017-2020,,,,
CompID900487,GRAPP,2025,International Conference on Computer Graphics Theory and Applications,,,,,,Qualis 2017-2020,,,,
CompID900488,GreenCom,2025,IEEE International Conference on Green Computing and Communications,,,,,,Qualis 2017-2020,,,,
CompID900489,GROUP,2025,International Conference on Supporting Group Work,,,,,,Qualis 2017-2020,,,,
CompID900490,GVIZ,2025,Workshop on New Directions in Geovisual Analytics,,,,,,Qualis 2017-2020,,,,
CompID900491,GWN,2025,International Global Wordnet Conference,,,,,,Qualis 2017-2020,,,,
CompID900492,HAIS,2025,International Conference on Hybrid Artificial Intelligence Systems,,,,,,Qualis 2017-2020,,,,
CompID900493,HAPTICS,2025,IEEE Haptics Symposium,,,,,,Qualis 2017-2020,,,,
CompID900494,HASE,2025,IEEE International Symposium on High Assurance Systems Engineering,,,,,,Qualis 2017-2020,,,,
CompID900495,HCOMP,2025,AAAI Conference on Human Computation and Crowdsourcing,,,,,,Qualis 2017-2020,,,,
CompID900496,HCSE,2025,International Conference on Human-Centered Software Engineering,,,,,,Qualis 2017-2020,,,,
CompID900497,HEALTHCOM,2025,"IEEE International Conference on E-health Networking, Application & Services",,,,,,Qualis 2017-2020,,,,
CompID900498,HEALTHINF,2025,International Conference on Health Informatics,,,,,,Qualis 2017-2020,,,,
CompID900499,HEALTHINFO,2025,"International Conference on Informatics and Assistive Technologies for Health-Care, Medical Support and Wellbeing",,,,,,Qualis 2017-2020,,,,
CompID900500,HICSS,2025,Hawaii International Conference on System Sciences,,,,,,Qualis 2017-2020,,,,
CompID900501,HILDA,2025,Workshop on Human-In-the-Loop Data Analytics,,,,,,Qualis 2017-2020,,,,
CompID900502,HIMS,2025,International Conference on Health Informatics and Medical Systems,,,,,,Qualis 2017-2020,,,,
CompID900503,HIPC,2025,IEEE International Conference on High Performance Computing,,,,,,Qualis 2017-2020,,,,
CompID900504,HIS,2025,International Conference on Hybrid Intelligent Systems,,,,,,Qualis 2017-2020,,,,
CompID900505,HM,2025,International Workshop on Hybrid Metaheuristics,,,,,,Qualis 2017-2020,,,,
CompID900506,HOST,2025,IEEE International Symposium on Hardware Oriented Security and Trust,,,,,,Qualis 2017-2020,,,,
CompID900507,HOTNETS,2025,ACM Workshop on Hot Topics in Networks,,,,,,Qualis 2017-2020,,,,
CompID900508,HPCA,2025,IEEE International Symposium on High Performance Computer Architecture,,,,,,Qualis 2017-2020,,,,
CompID900509,HPCC,2025,International Conference on High Performance Computing and Communications,,,,,,Qualis 2017-2020,,,,
CompID900510,HPCS,2025,International Conference on High Performance Computing & Simulation,,,,,,Qualis 2017-2020,,,,
CompID900511,HPDC,2025,International Symposium on High Performance Distributed Computing,,,,,,Qualis 2017-2020,,,,
CompID900512,HPSR,2025,IEEE High Performance Switching and Routing,,,,,,Qualis 2017-2020,,,,
CompID900513,HRI,2025,ACM/IEEE International Conference on Human Robot Interaction,,,,,,Qualis 2017-2020,,,,
CompID900514,HS,2025,Haskell Symposium,,,,,,Qualis 2017-2020,,,,
CompID900515,HSCC,2025,International Conference on Hybrid Systems: Computation and Control,,,,,,Qualis 2017-2020,,,,
CompID900516,HT,2025,ACM Conference on Hypertext and Social Media,,,,,,Qualis 2017-2020,,,,
CompID900517,Humanoids,2025,IEEE RAS International Conference on Humanoid Robot,,,,,,Qualis 2017-2020,,,,
CompID900518,Hypertext,2025,ACM Conference on Hypertext and Hypermedia,,,,,,Qualis 2017-2020,,,,
CompID900519,i-SAIRAS,2025,"International Symposium on Artificial Intelligence, Robotics and Automation in Space",,,,,,Qualis 2017-2020,,,,
CompID900520,I/ITSEC,2025,"Interservice/Industry Training, Simulation & Education Conference",,,,,,Qualis 2017-2020,,,,
CompID900521,I2MTC,2025,IEEE International Instrumentation and Measurement Technology Conference,,,,,,Qualis 2017-2020,,,,
CompID900522,I3D,2025,ACM SIGGRAPH Symposium on Interactive 3D Graphics and Games,,,,,,Qualis 2017-2020,,,,
CompID900523,IAAI,2025,International Conference of the Italian Association for Artificial Intelligence,,,,,,Qualis 2017-2020,,,,
CompID900524,IAS,2025,Industry Applications Society Annual Meeting,,,,,,Qualis 2017-2020,,,,
CompID900525,IAV,2025,IFAC Symposium on Intelligent Autonomous Vehicles,,,,,,Qualis 2017-2020,,,,
CompID900526,IBERAMIA,2025,Ibero-American Conference on Artificial Intelligence,,,,,,Qualis 2017-2020,,,,
CompID900527,IBERCHIP,2025,Workshop Iberchip,,,,,,Qualis 2017-2020,,,,
CompID900528,IC2E,2025,IEEE International Conference on Cloud Engineering,,,,,,Qualis 2017-2020,,,,
CompID900529,IC3K,2025,"International Joint Conference on Knowledge Discovery, Knowledge Engineering and Knowledge Management",,,,,,Qualis 2017-2020,,,,
CompID900530,ICA3PP,2025,International Conference on Algorithms and Architectures for Parallel Processing,,,,,,Qualis 2017-2020,,,,
CompID900531,ICAART,2025,International Conference on Agents and Artificial Intelligence,,,,,,Qualis 2017-2020,,,,
CompID900532,ICAI,2025,International Conference on Applied Informatics,,,,,,Qualis 2017-2020,,,,
CompID900533,ICAISC,2025,International Conference on Artificial Intelligence and Soft Computing,,,,,,Qualis 2017-2020,,,,
CompID900534,ICAIWC,2025,International Conference on Artificial Intelligence,,,,,,Qualis 2017-2020,,,,
CompID900535,ICALP,2025,"International Colloquium on Automata, Languages, and Programming",,,,,,Qualis 2017-2020,,,,
CompID900536,ICALT,2025,IEEE International Conference on Advanced Learning Technologies,,,,,,Qualis 2017-2020,,,,
CompID900537,ICANN,2025,International Conference on Artificial Neural Networks,,,,,,Qualis 2017-2020,,,,
CompID900538,ICAPS,2025,International Conference on Automated Planning and Scheduling,,,,,,Qualis 2017-2020,,,,
CompID900539,ICAR,2025,International Conference on Advanced Robotics,,,,,,Qualis 2017-2020,,,,
CompID900540,ICARA,2025,"International Conference on Automation, Robotics and Applications",,,,,,Qualis 2017-2020,,,,
CompID900541,ICARM,2025,International Conference on Advanced Robotics and Mechatronics,,,,,,Qualis 2017-2020,,,,
CompID900542,ICAROB,2025,International Conference on Artificial Life and Robotics,,,,,,Qualis 2017-2020,,,,
CompID900543,ICARSC,2025,IEEE International Conference on Autonomous Robot Systems and Competitions,,,,,,Qualis 2017-2020,,,,
CompID900544,ICARV,2025,"International Conference on Control, Automation, Robotics and Vision",,,,,,Qualis 2017-2020,,,,
CompID900545,ICAS-IARIA,2025,IARIA International Conference on Autonomic and Autonomous Systems,,,,,,Qualis 2017-2020,,,,
CompID900546,ICASSP,2025,"IEEE International Conference on Acoustics, Speech and Signal Processing",,,,,,Qualis 2017-2020,,,,
CompID900547,ICB,2025,International Conference on Biometrics,,,,,,Qualis 2017-2020,,,,
CompID900548,ICBC,2025,IEEE International Conference on Blockchain and Cryptocurrency,,,,,,Qualis 2017-2020,,,,
CompID900549,ICBIP,2025,International Conference on Biomedical Signal and Image Processing,,,,,,Qualis 2017-2020,,,,
CompID900550,ICBK,2025,International Conference on Big Knowledge,,,,,,Qualis 2017-2020,,,,
CompID900551,ICBL,2025,International Conference on Interactive Collaborative and Blended Learning,,,,,,Qualis 2017-2020,,,,
CompID900552,ICC,2025,IEEE International Conference on Communications,,,,,,Qualis 2017-2020,,,,
CompID900553,ICCA,2025,IEEE International Conference on Control and Automation,,,,,,Qualis 2017-2020,,,,
CompID900554,ICCABS,2025,International Conference on Computational Advances in Bio and Medical Sciences,,,,,,Qualis 2017-2020,,,,
CompID900555,ICCAD,2025,IEEE/ACM International Conference on Computer-Aided Design,,,,,,Qualis 2017-2020,,,,
CompID900556,ICCAR,2025,"International Conference on Control, Automation and Robotics",,,,,,Qualis 2017-2020,,,,
CompID900557,ICCC,2025,International Conference on Computational Creativity,,,,,,Qualis 2017-2020,,,,
CompID900558,ICCCBE,2025,International Conference on Computing in Civil and Building Engineering,,,,,,Qualis 2017-2020,,,,
CompID900559,ICCCN,2025,International Conference on Computer Communications and Networks,,,,,,Qualis 2017-2020,,,,
CompID900560,ICCD,2025,International Conference on Computer Design,,,,,,Qualis 2017-2020,,,,
CompID900561,ICCDCS,2025,"International Caribbean Conference on Devices, Circuits and Systems",,,,,,Qualis 2017-2020,,,,
CompID900562,ICCE-EDU,2025,International Conference on Computers in Education,,,,,,Qualis 2017-2020,,,,
CompID900563,iCCECE,2025,"International Conference on Computing, Electronics & Communications Engineering",,,,,,Qualis 2017-2020,,,,
CompID900564,ICCHP,2025,International Conference on Computers Helping People with Special Needs,,,,,,Qualis 2017-2020,,,,
CompID900565,ICCL2,2025,International Conference on Computational Logistics,,,,,,Qualis 2017-2020,,,,
CompID900566,ICCP,2025,IEEE International Conference on Intelligent Computer Communication and Processing,,,,,,Qualis 2017-2020,,,,
CompID900567,ICCPR,2025,International Conference on Computing and Pattern Recognition,,,,,,Qualis 2017-2020,,,,
CompID900568,ICCPS,2025,International Conference on Cyber-Physical Systems,,,,,,Qualis 2017-2020,,,,
CompID900569,ICCS,2025,International Conference on Computational Science,,,,,,Qualis 2017-2020,,,,
CompID900570,ICCSA,2025,International Conference on Computational Science and Its Applications,,,,,,Qualis 2017-2020,,,,
CompID900571,ICCSPA,2025,"International Conference on Communications, Signal Processing, and their Applications",,,,,,Qualis 2017-2020,,,,
CompID900572,ICCStr,2025,International Conference on Conceptual Structures,,,,,,Qualis 2017-2020,,,,
CompID900573,ICCTCC,2025,"International Conference on Computability Theory, Computability and Complexity",,,,,,Qualis 2017-2020,,,,
CompID900574,ICCV,2025,IEEE International Conference on Computer Vision,,,,,,Qualis 2017-2020,,,,
CompID900575,ICCVW,2025,IEEE International Conference on Computer Vision Workshops,,,,,,Qualis 2017-2020,,,,
CompID900576,ICCW,2025,IEEE International Conference on Communications Workshops,,,,,,Qualis 2017-2020,,,,
CompID900577,ICDAR,2025,International Conference on Document Analysis and Recognition,,,,,,Qualis 2017-2020,,,,
CompID900578,ICDCN,2025,International Conference on Distributed Computing and Networking,,,,,,Qualis 2017-2020,,,,
CompID900579,ICDCS,2025,International Conference on Distributed Computing Systems,,,,,,Qualis 2017-2020,,,,
CompID900580,ICDCSW,2025,International Conference on Distributed Computing Systems Workshops,,,,,,Qualis 2017-2020,,,,
CompID900581,ICDE,2025,IEEE International Conference on Data Engineering,,,,,,Qualis 2017-2020,,,,
CompID900582,ICDF,2025,IFIP International Conference on Digital Forensics,,,,,,Qualis 2017-2020,,,,
CompID900583,ICDIM,2025,International Conference on Digital Information Management,,,,,,Qualis 2017-2020,,,,
CompID900584,ICDIP,2025,International Conference on Digital Image Processing,,,,,,Qualis 2017-2020,,,,
CompID900585,ICDL-EpiRob,2025,IEEE International Conference on Development and Learning and Epigenetic Robotics,,,,,,Qualis 2017-2020,,,,
CompID900586,ICDM,2025,IEEE International Conference on Data Mining,,,,,,Qualis 2017-2020,,,,
CompID900587,ICDMW,2025,IEEE International Conference on Data Mining Workshop,,,,,,Qualis 2017-2020,,,,
CompID900588,ICDT,2025,International Conference on Database Theory,,,,,,Qualis 2017-2020,,,,
CompID900589,ICE-CCN,2025,"International Conference on Emerging Trends in Computing, Communication and Nanotechnology",,,,,,Qualis 2017-2020,,,,
CompID900590,ICEBE,2025,IEEE International Conference on e-Business Engineering,,,,,,Qualis 2017-2020,,,,
CompID900591,ICEC,2025,IFIP International Conference on Entertainment Computing,,,,,,Qualis 2017-2020,,,,
CompID900592,ICECS,2025,"IEEE International Conference on Electronics, Circuits and Systems",,,,,,Qualis 2017-2020,,,,
CompID900593,ICEDEG,2025,International Conference on eDemocracy & eGovernment,,,,,,Qualis 2017-2020,,,,
CompID900594,ICEGOV,2025,International Conference on Theory and Practice of Eletronic Governance,,,,,,Qualis 2017-2020,,,,
CompID900595,ICEIS,2025,International Conference on Enterprise Information Systems,,,,,,Qualis 2017-2020,,,,
CompID900596,ICER,2025,International Computing Education Research,,,,,,Qualis 2017-2020,,,,
CompID900597,ICERI,2025,"International Conference of Education, Research and Innovation",,,,,,Qualis 2017-2020,,,,
CompID900598,ICFCA,2025,International Conference on Formal Concept Analysis,,,,,,Qualis 2017-2020,,,,
CompID900599,ICFEM,2025,International Conference on Formal Engineering Methods,,,,,,Qualis 2017-2020,,,,
CompID900600,ICFHR,2025,International Conference on Frontiers in Handwriting Recognition,,,,,,Qualis 2017-2020,,,,
CompID900601,ICFNDS,2025,International Conference on Future Networks and Distributed Systems,,,,,,Qualis 2017-2020,,,,
CompID900602,ICFP,2025,International Conference on Functional Programming,,,,,,Qualis 2017-2020,,,,
CompID900603,ICGI,2025,International Conference on Grammatical Inference,,,,,,Qualis 2017-2020,,,,
CompID900604,ICGJ,2025,"International Conference on Game Jams, Hackathons, and Game Creation Events",,,,,,Qualis 2017-2020,,,,
CompID900605,ICGSE,2025,IEEE International Conference on Global Software Engineering,,,,,,Qualis 2017-2020,,,,
CompID900606,ICGT,2025,International Conference on Graph Transformation,,,,,,Qualis 2017-2020,,,,
CompID900607,ICHI,2025,IEEE International Conference on Healthcare Informatics,,,,,,Qualis 2017-2020,,,,
CompID900608,ICIAP,2025,International Conference on Image Analysis and Processing,,,,,,Qualis 2017-2020,,,,
CompID900609,ICIAR,2025,International Conference on Image Analysis and Recognition,,,,,,Qualis 2017-2020,,,,
CompID900610,ICIC,2025,International Conference on Intelligent Computing,,,,,,Qualis 2017-2020,,,,
CompID900611,ICICS,2025,International Conference on Information and Communications Security,,,,,,Qualis 2017-2020,,,,
CompID900612,ICICT,2025,International Conference on Information and Computer Technologies,,,,,,Qualis 2017-2020,,,,
CompID900613,ICIDS,2025,International Conference on Interactive Digital Storytelling,,,,,,Qualis 2017-2020,,,,
CompID900614,ICIIECS,2025,"International Conference on Innovations in Information, Embedded and Communication Systems",,,,,,Qualis 2017-2020,,,,
CompID900615,ICINCO,2025,"International Conference on Informatics in Control, Automation and Robotics",,,,,,Qualis 2017-2020,,,,
CompID900616,ICIOT,2025,International Conference on the Internet of Things,,,,,,Qualis 2017-2020,,,,
CompID900617,ICIP,2025,IEEE International Conference on Image Processing,,,,,,Qualis 2017-2020,,,,
CompID900618,ICIRA,2025,International Conference on Intelligent Robotics and Applications,,,,,,Qualis 2017-2020,,,,
CompID900619,ICIS,2025,International Conference on Information Systems,,,,,,Qualis 2017-2020,,,,
CompID900620,ICISC,2025,International Conference on Information Security and Cryptology,,,,,,Qualis 2017-2020,,,,
CompID900621,ICISO,2025,International Conference on Informatics and Semiotics in Organisations,,,,,,Qualis 2017-2020,,,,
CompID900622,ICISS,2025,International Conference on Information Systems Security,,,,,,Qualis 2017-2020,,,,
CompID900623,ICIST,2025,International Conference on Information and Software Technologies,,,,,,Qualis 2017-2020,,,,
CompID900624,ICIT,2025,IEEE International Conference on Industrial Technology,,,,,,Qualis 2017-2020,,,,
CompID900625,ICITS,2025,International Conference on Information Theoretic Security,,,,,,Qualis 2017-2020,,,,
CompID900626,ICITST,2025,International Conference for Internet Technology and Secured Transactions,,,,,,Qualis 2017-2020,,,,
CompID900627,ICIVC,2025,"International Conference on Image, Vision and Computing",,,,,,Qualis 2017-2020,,,,
CompID900628,ICL,2025,International Conference on Interactive Collaborative Learning,,,,,,Qualis 2017-2020,,,,
CompID900629,ICLP,2025,International Conference on Logic Programming,,,,,,Qualis 2017-2020,,,,
CompID900630,ICLR,2025,International Conference on Learning Representations,,,,,,Qualis 2017-2020,,,,
CompID900631,ICM,2025,International Conference on Microelectronics,,,,,,Qualis 2017-2020,,,,
CompID900632,ICMA,2025,IEEE International Conference on Mechatronics and Automation,,,,,,Qualis 2017-2020,,,,
CompID900633,ICMC,2025,International Computer Music Conference,,,,,,Qualis 2017-2020,,,,
CompID900634,ICMCR,2025,"International Conference on Mechatronics, Control and Robotics",,,,,,Qualis 2017-2020,,,,
CompID900635,ICME,2025,IEEE International Conference on Multimedia and Expo,,,,,,Qualis 2017-2020,,,,
CompID900636,ICMEW,2025,IEEE International Conference on Multimedia and Expo Workshops,,,,,,Qualis 2017-2020,,,,
CompID900637,ICMI,2025,ACM International Conference on Multimodal Interfaces,,,,,,Qualis 2017-2020,,,,
CompID900638,ICMIS,2025,International Conference on Mathematics & Information Science,,,,,,Qualis 2017-2020,,,,
CompID900639,ICML,2025,International Conference on Machine Learning,,,,,,Qualis 2017-2020,,,,
CompID900640,ICMLA,2025,IEEE International Conference on Machine Learning and Applications,,,,,,Qualis 2017-2020,,,,
CompID900641,ICMLC,2025,International Conference on Machine Learning and Computing,,,,,,Qualis 2017-2020,,,,
CompID900642,ICMPC,2025,International Conference on Music Perception and Cognition,,,,,,Qualis 2017-2020,,,,
CompID900643,ICMR,2025,ACM International Conference on Multimedia Retrieval,,,,,,Qualis 2017-2020,,,,
CompID900644,ICN-IARIA,2025,IARIA International Conference on Networks,,,,,,Qualis 2017-2020,,,,
CompID900645,ICNC,2025,"International Conference on Computing, Networking and Communications",,,,,,Qualis 2017-2020,,,,
CompID900646,ICNC-FSKD,2025,"International Conference on Natural Computation, Fuzzy Systems and Knowledge Discovery",,,,,,Qualis 2017-2020,,,,
CompID900647,ICNP,2025,International Conference on Network Protocols,,,,,,Qualis 2017-2020,,,,
CompID900648,ICNSC,2025,"IEEE International Conference on Networking, Sensing and Control",,,,,,Qualis 2017-2020,,,,
CompID900649,ICOIN,2025,International Conference on Information Networking,,,,,,Qualis 2017-2020,,,,
CompID900650,ICOMPWC,2025,International Conference on Internet Computing and Internet of Things,,,,,,Qualis 2017-2020,,,,
CompID900651,ICONIP,2025,International Conference on Neural Information Processing,,,,,,Qualis 2017-2020,,,,
CompID900652,ICORES,2025,International Conference on Operations Research and Enterprise Systems,,,,,,Qualis 2017-2020,,,,
CompID900653,ICORR,2025,IEEE International Conference on Rehabilitation Robotics,,,,,,Qualis 2017-2020,,,,
CompID900654,ICPADS,2025,International Conference on Parallel and Distributed Systems,,,,,,Qualis 2017-2020,,,,
CompID900655,ICPC,2025,International Conference on Program Comprehension,,,,,,Qualis 2017-2020,,,,
CompID900656,ICPE,2025,International Conference on Performance Engineering,,,,,,Qualis 2017-2020,,,,
CompID900657,ICPME,2025,"International Conference on Philosophy, Music and Emotion",,,,,,Qualis 2017-2020,,,,
CompID900658,ICPP,2025,International Conference on Parallel Processing,,,,,,Qualis 2017-2020,,,,
CompID900659,ICPR,2025,International Conference on Pattern Recognition,,,,,,Qualis 2017-2020,,,,
CompID900660,ICRA,2025,IEEE International Conference on Robotics and Automation,,,,,,Qualis 2017-2020,,,,
CompID900661,ICRAE,2025,International Conference on Robotics and Automation Engineering,,,,,,Qualis 2017-2020,,,,
CompID900662,ICRC,2025,IEEE International Conference on Rebooting Computing,,,,,,Qualis 2017-2020,,,,
CompID900663,ICRES,2025,International Conference on Robot Ethics and Standards,,,,,,Qualis 2017-2020,,,,
CompID900664,ICS,2025,International Conference on Supercomputing,,,,,,Qualis 2017-2020,,,,
CompID900665,ICSC,2025,International Conference on Semantic Computing,,,,,,Qualis 2017-2020,,,,
CompID900666,ICSE,2025,International Conference on Software Engineering,,,,,,Qualis 2017-2020,,,,
CompID900667,ICSEA-IARIA,2025,IARIA International Conference on Software Engineering Advances,,,,,,Qualis 2017-2020,,,,
CompID900668,ICSESS,2025,International Conference on Software Engineering and Service Science,,,,,,Qualis 2017-2020,,,,
CompID900669,ICSEW,2025,International Conference on Software Engineering Workshops,,,,,,Qualis 2017-2020,,,,
CompID900670,ICSI,2025,International Conference on Swarm Intelligence,,,,,,Qualis 2017-2020,,,,
CompID900671,ICSIP,2025,IEEE International Conference on Signal and Image Processing,,,,,,Qualis 2017-2020,,,,
CompID900672,ICSLE,2025,International Conference on Smart Learning Environments,,,,,,Qualis 2017-2020,,,,
CompID900673,ICSME,2025,IEEE International Conference on Software Maintenance and Evolution,,,,,,Qualis 2017-2020,,,,
CompID900674,ICSOB,2025,International Conference on Software Business,,,,,,Qualis 2017-2020,,,,
CompID900675,ICSOC,2025,International Conference on Service Oriented Computing,,,,,,Qualis 2017-2020,,,,
CompID900676,ICSOFT,2025,International Conference on Software Technologies,,,,,,Qualis 2017-2020,,,,
CompID900677,ICSPCEC,2025,"International Conference on Signal Processing, Communication, Power and Embedded System",,,,,,Qualis 2017-2020,,,,
CompID900678,ICSR,2025,International Conference on Software Reuse,,,,,,Qualis 2017-2020,,,,
CompID900679,ICST,2025,International Conference on Sensing Technology,,,,,,Qualis 2017-2020,,,,
CompID900680,ICSTV,2025,"IEEE International Conference on Software Testing, Verification and Validation",,,,,,Qualis 2017-2020,,,,
CompID900681,ICSTW,2025,"IEEE International Conference on Software Testing, Verification and Validation Workshops",,,,,,Qualis 2017-2020,,,,
CompID900682,ICT,2025,International Conference on Telecommunications,,,,,,Qualis 2017-2020,,,,
CompID900683,ICTAC,2025,International Colloquium on Theoretical Aspects of Computing,,,,,,Qualis 2017-2020,,,,
CompID900684,ICTAI,2025,IEEE International Conference on Tools with Artificial Intelligence,,,,,,Qualis 2017-2020,,,,
CompID900685,ICTC,2025,International Conference on Information and Communication Technology Convergence,,,,,,Qualis 2017-2020,,,,
CompID900686,ICTCS,2025,Italian Conference on Theoretical Computer Science,,,,,,Qualis 2017-2020,,,,
CompID900687,ICTIR,2025,Conference on the Theory of Information Retrieval,,,,,,Qualis 2017-2020,,,,
CompID900688,ICTON,2025,International Conference on Transparent Optical Networks,,,,,,Qualis 2017-2020,,,,
CompID900689,ICTSS,2025,IFIP International Conference on Testing Software and Systems,,,,,,Qualis 2017-2020,,,,
CompID900690,ICUAS,2025,International Conference on Unmanned Aircraft Systems,,,,,,Qualis 2017-2020,,,,
CompID900691,ICUMT,2025,International Conference on Ultra Modern Telecommunications,,,,,,Qualis 2017-2020,,,,
CompID900692,ICVIIP,2025,International Conference on Visualization: Imaging and Image Processing,,,,,,Qualis 2017-2020,,,,
CompID900693,ICVR,2025,International Conference on Virtual Rehabilitation,,,,,,Qualis 2017-2020,,,,
CompID900694,ICVRV,2025,International Conference on Virtual Reality and Visualization,,,,,,Qualis 2017-2020,,,,
CompID900695,ICVS,2025,International Conference on Computer Vision Systems,,,,,,Qualis 2017-2020,,,,
CompID900696,ICWE,2025,International Conference on Web Engineering,,,,,,Qualis 2017-2020,,,,
CompID900697,ICWL,2025,International Conference on Web-Based Learning,,,,,,Qualis 2017-2020,,,,
CompID900698,ICWN,2025,International Conference on Wireless Networks,,,,,,Qualis 2017-2020,,,,
CompID900699,ICWS,2025,IEEE International Conference on Web Services,,,,,,Qualis 2017-2020,,,,
