ID Conferencia,Sigla,Ano Dados,Nome do evento,Siglas Alternativas,Nomes Alternativos,Sociedade,Avaliação SBC,SBC-CE,Origem Cadastro,Anais,SOL ID,GS ID,DBLP ID
CompID900935,MESA,2025,IEEE/ASME International Conference on Mechatronic and Embedded Systems and Applications,,,,,,Qualis 2017-2020,,,,
CompID900936,META,2025,International Workshop on Meta-Programming Techniques and Reflection,,,,,,Qualis 2017-2020,,,,
CompID900937,MetaLearn,2025,Workshop on Meta-Learning,,,,,,Qualis 2017-2020,,,,
CompID900938,MFCS,2025,International Symposium on Mathematical Foundations of Computer Science,,,,,,Qualis 2017-2020,,,,
CompID900939,MFI,2025,IEEE International Conference on Multisensor Fusion and Integration for Intelligent Systems,,,,,,Qualis 2017-2020,,,,
CompID900940,MIC,2025,Metaheuristics International Conference,,,,,,Qualis 2017-2020,,,,
CompID900941,MICAI,2025,Mexican International Conference on Artificial Intelligence,,,,,,Qualis 2017-2020,,,,
CompID900942,MICRO,2025,IEEE/ACM International Symposium on Microarchitecture,,,,,,Qualis 2017-2020,,,,
CompID900943,MIDDLEWARE,2025,International Middleware Conference,,,,,,Qualis 2017-2020,,,,
CompID900944,MIE,2025,Medical Informatics Europe,,,,,,Qualis 2017-2020,,,,
CompID900945,MIG,2025,ACM Siggraph Conference on Motion in Games,,,,,,Qualis 2017-2020,,,,
CompID900946,MILCOM,2025,Military Communications Conference,,,,,,Qualis 2017-2020,,,,
CompID900947,MISE,2025,Workshop on Modeling in Software Engineering,,,,,,Qualis 2017-2020,,,,
CompID900948,MIXDES,2025,International Conference on Mixed Design of Integrated Circuits and Systems,,,,,,Qualis 2017-2020,,,,
CompID900949,ML4H,2025,Machine Learning for Health,,,,,,Qualis 2017-2020,,,,
CompID900950,MLDM,2025,International Conference on Machine Learning and Data Mining in Pattern Recognition,,,,,,Qualis 2017-2020,,,,
CompID900951,MLOBD,2025,"International Workshop on Machine Learning, Optimization and Big Data",,,,,,Qualis 2017-2020,,,,
CompID900952,MLSP,2025,IEEE International Workshop on Machine Learning for Signal Processing,,,,,,Qualis 2017-2020,,,,
CompID900953,MMAR,2025,International Conference on Methods and Models in Automation and Robotics,,,,,,Qualis 2017-2020,,,,
CompID900954,MMM,2025,International Conference on Multimedia Modelling,,,,,,Qualis 2017-2020,,,,
CompID900955,MMRP,2025,International Workshop on Multilayer Music Representation and Processing,,,,,,Qualis 2017-2020,,,,
CompID900956,MMSP,2025,International Workshop on Multimedia and Signal Processing,,,,,,Qualis 2017-2020,,,,
CompID900957,MMSYS,2025,ACM Multimedia Systems Conference,,,,,,Qualis 2017-2020,,,,
CompID900958,MNR,2025,Mostra Nacional de Robótica,,,,,,Qualis 2017-2020,,,,
CompID900959,MobiArch,2025,Workshop on Mobility in the Evolving Internet Architecture,,,,,,Qualis 2017-2020,,,,
CompID900960,MOBICOM,2025,ACM/IEEE International Conference on Mobile Computing and Networking,,,,,,Qualis 2017-2020,,,,
CompID900961,MOBIHOC,2025,ACM International Symposium on Mobile Ad Hoc Networking and Computing,,,,,,Qualis 2017-2020,,,,
CompID900962,MOBILEHCI,2025,International Conference on Human-Computer Interaction with Mobile Devices and Services,,,,,,Qualis 2017-2020,,,,
CompID900963,MOBILESOFT,2025,International Conference on Mobile Software Engineering and Systems,,,,,,Qualis 2017-2020,,,,
CompID900964,MOBIQUITOUS,2025,"International Conference on Mobile and Ubiquitous Systems: Computing, Networking and Services",,,,,,Qualis 2017-2020,,,,
CompID900965,MobiSys,2025,"Annual International Conference on Mobile Systems, Applications, and Services",,,,,,Qualis 2017-2020,,,,
CompID900966,MOBIWAC,2025,ACM International Symposium on Mobility Management and Wireless Access,,,,,,Qualis 2017-2020,,,,
CompID900967,MOCO,2025,International Conference on Movement and Computing,,,,,,Qualis 2017-2020,,,,
CompID900968,MODELS,2025,International Conference on Model Driven Engineering Languages and Systems,,,,,,Qualis 2017-2020,,,,
CompID900969,MODELSWARD,2025,International Conference on Model-Driven Engineering and Software Development,,,,,,Qualis 2017-2020,,,,
CompID900970,MODRE,2025,International Model-Driven Requirements Engineering,,,,,,Qualis 2017-2020,,,,
CompID900971,MODULARITY,2025,International Conference on Modularity,,,,,,Qualis 2017-2020,,,,
CompID900972,MoMM,2025,International Conference on Advances in Mobile Computing & Multimedia,,,,,,Qualis 2017-2020,,,,
CompID900973,MRS,2025,International Symposium on Multi-Robot and Multi-Agent Systems,,,,,,Qualis 2017-2020,,,,
CompID900974,MSN,2025,International Conference on Mobile Ad-Hoc and Sensor Networks,,,,,,Qualis 2017-2020,,,,
CompID900975,MSR,2025,Working Conference on Mining Software Repositories,,,,,,Qualis 2017-2020,,,,
CompID900976,MSSiS,2025,Workshop deModelagem e Simulação de Sistemas Intensivos em Software,,,,,,Qualis 2017-2020,,,,
CompID900977,MSST,2025,IEEE Symposium on Mass Storage Systems and Technologies,,,,,,Qualis 2017-2020,,,,
CompID900978,MSWIM,2025,"ACM International Conference on Modeling, Analysis and Simulation of Wireless and Mobile Systems",,,,,,Qualis 2017-2020,,,,
CompID900979,MTSR,2025,International Conference on Metadata and Semantics Research,,,,,,Qualis 2017-2020,,,,
CompID900980,MULTI,2025,International Workshop on Multi-Level Modeling,,,,,,Qualis 2017-2020,,,,
CompID900981,MULTITEMP,2025,International Workshop on the Analysis of Multitemporal Remote Sensing Images,,,,,,Qualis 2017-2020,,,,
CompID900982,MUM,2025,International Conference on Mobile and Ubiquitous Multimedia,,,,,,Qualis 2017-2020,,,,
CompID900983,MVA,2025,IAPR International Conference on Machine Vision Applications,,,,,,Qualis 2017-2020,,,,
CompID900984,MWE,2025,Workshop on Multiword Expressions,,,,,,Qualis 2017-2020,,,,
CompID900985,MWSCAS,2025,International Midwest Symposium on Circuits and Systems,,,,,,Qualis 2017-2020,,,,
CompID900986,NAACL,2025,North American Chapter of the Association for Computational Linguistics Annual Meeting,,,,,,Qualis 2017-2020,,,,
CompID900987,NAFIPS,2025,Annual Conference of the North American Fuzzy Information Processing Society,,,,,,Qualis 2017-2020,,,,
CompID900988,NCA,2025,IEEE International Symposium on Network Computing and Applications,,,,,,Qualis 2017-2020,,,,
CompID900989,NDSS,2025,Network and Distributed System Security Symposium,,,,,,Qualis 2017-2020,,,,
CompID900990,NESY@HLAI,2025,Workshop on Neural-Symbolic Learning and Reasoning,,,,,,Qualis 2017-2020,,,,
CompID900991,NETSOFT,2025,IEEE Conference on Network Softwarization,,,,,,Qualis 2017-2020,,,,
CompID900992,NetSys,2025,International Conference on Networked Systems,,,,,,Qualis 2017-2020,,,,
CompID900993,NETWORKING,2025,IFIP Networking Conference,,,,,,Qualis 2017-2020,,,,
CompID900994,NETWORKS,2025,International Telecommunications Network Strategy and Planning Symposium,,,,,,Qualis 2017-2020,,,,
CompID900995,NeurIPS,2025,Neural Information Processing Systems,,,,,,Qualis 2017-2020,,,,
CompID900996,NEW2AN,2025,"International Conference on Internet of Things, Smart Spaces, and Next Generation Networks and Systems",,,,,,Qualis 2017-2020,,,,
CompID900997,NEWCAS,2025,IEEE International New Circuits and Systems Conference,,,,,,Qualis 2017-2020,,,,
CompID900998,NFM,2025,NASA Formal Methods Symposium,,,,,,Qualis 2017-2020,,,,
CompID900999,NFV-SDN,2025,IEEE Conference on Network Function Virtualization and Software Defined Networks,,,,,,Qualis 2017-2020,,,,
CompID901000,NHT,2025,Workshop on Narrative and Hypertext,,,,,,Qualis 2017-2020,,,,
CompID901001,NIME,2025,International Conference on New Interfaces for Musical Expression,,,,,,Qualis 2017-2020,,,,
CompID901002,NLDB,2025,International Conference on Application of Natural Language to Information Systems,,,,,,Qualis 2017-2020,,,,
CompID901003,NOCS,2025,ACM/IEEE International Symposium on Networks-on-Chip,,,,,,Qualis 2017-2020,,,,
CompID901004,NOF,2025,International Conference on Network of the Future,,,,,,Qualis 2017-2020,,,,
CompID901005,NOMS,2025,IEEE/IFIP Network Operations and Management Symposium,,,,,,Qualis 2017-2020,,,,
CompID901006,NORCAS,2025,Nordic Circuits and Systems Conference,,,,,,Qualis 2017-2020,,,,
CompID901007,NordiCHI,2025,Nordic Conference on Human-Computer Interaction,,,,,,Qualis 2017-2020,,,,
CompID901008,NSDI,2025,Networked Systems Design and Implementation,,,,,,Qualis 2017-2020,,,,
CompID901009,NSS,2025,Network and System Security,,,,,,Qualis 2017-2020,,,,
CompID901010,NSV,2025,International Workshop on Numerical Software Verification,,,,,,Qualis 2017-2020,,,,
CompID901011,NTMS,2025,"IFIP International Conference on New Technologies, Mobility and Security",,,,,,Qualis 2017-2020,,,,
CompID901012,OCEAN,2025,IEEE Oceans Conference,,,,,,Qualis 2017-2020,,,,
CompID901013,OM,2025,International Workshop on Ontology Matching,,,,,,Qualis 2017-2020,,,,
CompID901014,ONDM,2025,Conference on Optical Network Design and Modeling,,,,,,Qualis 2017-2020,,,,
CompID901015,ONTOBRAS,2025,Seminar on Ontology Research in Brazil,,,,,,Qualis 2017-2020,,,,
CompID901016,Onward!,2025,Onward!,,,,,,Qualis 2017-2020,,,,
CompID901017,OOPSLA,2025,"Conference on Object-Oriented Programming Systems, Languages, and Applications",,,,,,Qualis 2017-2020,,,,
CompID901018,OpenSym,2025,International Symposium on Open Collaboration,,,,,,Qualis 2017-2020,,,,
CompID901019,OPODIS,2025,International Conference on Principles of Distributed Systems,,,,,,Qualis 2017-2020,,,,
CompID901020,OR,2025,International Conference on Operations Research,,,,,,Qualis 2017-2020,,,,
CompID901021,OSDI,2025,USENIX Symposium on Operating Systems Design and Implementation,,,,,,Qualis 2017-2020,,,,
CompID901022,OSS,2025,International Conference on Open Source Systems,,,,,,Qualis 2017-2020,,,,
CompID901023,OzCHI,2025,Australian Conference on Human-Computer Interaction,,,,,,Qualis 2017-2020,,,,
CompID901024,PAAMS,2025,"International Conference on Practical Applications of Agents, Multi-Agent Systems and Sustainability",,,,,,Qualis 2017-2020,,,,
CompID901025,PAAR,2025,Practical Aspects of Automated Reasoning,,,,,,Qualis 2017-2020,,,,
CompID901026,PACBB,2025,International Conference on Practical Applications of Computational Biology & Bioinformatics,,,,,,Qualis 2017-2020,,,,
CompID901027,PacificVis,2025,IEEE Pacific Visualization Symposium,,,,,,Qualis 2017-2020,,,,
CompID901028,PACIS,2025,Pacific Asia Conference on Information Systems,,,,,,Qualis 2017-2020,,,,
CompID901029,PACT,2025,International Conference on Parallel Computing Technologies,,,,,,Qualis 2017-2020,,,,
CompID901030,PACTT,2025,International Conference on Parallel Architectures and Compilation Techniques,,,,,,Qualis 2017-2020,,,,
CompID901031,PAKDD,2025,Pacific-Asia Conference on Knowledge Discovery and Data Mining,,,,,,Qualis 2017-2020,,,,
CompID901032,PAM,2025,Passive and Active Network Measurement Conference,,,,,,Qualis 2017-2020,,,,
CompID901033,ParCO,2025,International Conference on Parallel Computing,,,,,,Qualis 2017-2020,,,,
CompID901034,PATAT,2025,International Conference on the Practice and Theory of Automated Timetabling,,,,,,Qualis 2017-2020,,,,
CompID901035,PATMOS,2025,"International Workshop on Power and Timing Modeling, Optimization and Simulation",,,,,,Qualis 2017-2020,,,,
CompID901036,PATTERNS,2025,International Conferences on Pervasive Patterns and Applications,,,,,,Qualis 2017-2020,,,,
CompID901037,PDC,2025,Participatory Design Conference,,,,,,Qualis 2017-2020,,,,
CompID901038,PDCAT,2025,"International Conference on Parallel and Distributed Computing, Applications and Technologies",,,,,,Qualis 2017-2020,,,,
CompID901039,PDES,2025,IFAC International Conference on Programmable Devices and Embedded Systems,,,,,,Qualis 2017-2020,,,,
CompID901040,PDP,2025,"Euromicro International Conference on Parallel, Distributed and Network-Based Processing",,,,,,Qualis 2017-2020,,,,
CompID901041,PE-WASUN,2025,"ACM International Symposium on Performance Evaluation of Wireless Ad Hoc, Sensor, and Ubiquitous Networks",,,,,,Qualis 2017-2020,,,,
CompID901042,PECCS,2025,Pervasive and Embedded Computing and Communication Systems,,,,,,Qualis 2017-2020,,,,
CompID901043,PERCOM,2025,International Conference on Pervasive Computing and Communications,,,,,,Qualis 2017-2020,,,,
CompID901044,PerComW,2025,IEEE International Conference on Pervasive Computing and Communication Workshops,,,,,,Qualis 2017-2020,,,,
CompID901045,PervasiveHealth,2025,International Conference on Pervasive Computing Technologies for Healthcare,,,,,,Qualis 2017-2020,,,,
CompID901046,PESOS,2025,International Workshop on Principles of Engineering Service-Oriented and Cloud Systems,,,,,,Qualis 2017-2020,,,,
CompID901047,PETRA,2025,ACM International Conference on PErvasive Technologies Related to Assistive Environments,,,,,,Qualis 2017-2020,,,,
CompID901048,PG,2025,Pacific Conference on Computer Graphics and Applications,,,,,,Qualis 2017-2020,,,,
CompID901049,PGM,2025,International Conference on Probabilistic Graphical Models,,,,,,Qualis 2017-2020,,,,
CompID901050,PIMRC,2025,"International Symposium on Personal, Indoor and Mobile Radio Communications",,,,,,Qualis 2017-2020,,,,
CompID901051,PKC,2025,International Conference on Practice and Theory in Public Key Cryptography,,,,,,Qualis 2017-2020,,,,
CompID901052,PLATIAL,2025,International Symposium on Platial Information Science,,,,,,Qualis 2017-2020,,,,
CompID901053,PLDI,2025,SIGPLAN Conference on Programming Language Design and Implementation,,,,,,Qualis 2017-2020,,,,
CompID901054,PLOP,2025,Conference on Pattern Languages of Programs,,,,,,Qualis 2017-2020,,,,
CompID901055,PODC,2025,ACM Symposium on Principles of Distributed Computing,,,,,,Qualis 2017-2020,,,,
CompID901056,PODS,2025,Symposium on Principles of Database Systems,,,,,,Qualis 2017-2020,,,,
CompID901057,PoEM,2025,IFIP WG 8.1 Working Conference on the Practice of Enterprise Modelling,,,,,,Qualis 2017-2020,,,,
CompID901058,POPL,2025,Symposium on Principles of Programming Languages,,,,,,Qualis 2017-2020,,,,
CompID901059,POST,2025,International Conference on Principles of Security and Trust,,,,,,Qualis 2017-2020,,,,
CompID901060,PP,2025,SIAM Conference on Parallel Processing for Scientific Computing,,,,,,Qualis 2017-2020,,,,
CompID901061,PPAM,2025,International Conference on Parallel Processing and Applied Mathematics,,,,,,Qualis 2017-2020,,,,
CompID901062,PPDP,2025,International Symposium on Principles and Practice of Declarative Programming,,,,,,Qualis 2017-2020,,,,
CompID901063,PPOPP,2025,ACM SIGPLAN Symposium on Principles and Practice of Parallel Programming,,,,,,Qualis 2017-2020,,,,
CompID901064,PPSN,2025,International Conference on Parallel Problem Solving from Nature,,,,,,Qualis 2017-2020,,,,
CompID901065,PRDC,2025,Pacific Rim International Symposium on Dependable Computing,,,,,,Qualis 2017-2020,,,,
CompID901066,PredictGIS,2025,International Workshop on Prediction of Human Mobility,,,,,,Qualis 2017-2020,,,,
CompID901067,PRIMA,2025,nternational Conference on Principles and Practice of Multi-Agent Systems,,,,,,Qualis 2017-2020,,,,
CompID901068,PrivOn,2025,"Workshop on Society, Privacy and the Semantic Web",,,,,,Qualis 2017-2020,,,,
CompID901069,PROFES,2025,International Conference on Product-Focused Software Process Improvement,,,,,,Qualis 2017-2020,,,,
CompID901070,PROMISE,2025,International Conference on Predictive Models and Data Analytics in Software Engineering,,,,,,Qualis 2017-2020,,,,
CompID901071,PROPOR,2025,International Conference on Computational Processing of the Portuguese Language,,,,,,Qualis 2017-2020,,,,
CompID901072,PSB,2025,Pacific Symposium on Biocomputing,,,,,,Qualis 2017-2020,,,,
CompID901073,PSCC,2025,Power Systems Computation Conference,,,,,,Qualis 2017-2020,,,,
CompID901074,PST,2025,"International Conference on Privacy, Security and Trust",,,,,,Qualis 2017-2020,,,,
CompID901075,Q2SWinet,2025,ACM Symposium on QoS and Security for Wireless and Mobile Networks,,,,,,Qualis 2017-2020,,,,
CompID901076,QoMEX,2025,International Workshop on Quality of Multimedia Experience,,,,,,Qualis 2017-2020,,,,
CompID901077,QUATIC,2025,International Conference on Quality of Information and Communications Technology,,,,,,Qualis 2017-2020,,,,
CompID901078,RADECS,2025,European Conference on Radiation and its Effects on Components and Systems,,,,,,Qualis 2017-2020,,,,
CompID901079,RAHA,2025,IEEE Internacional Conference on Robotics and Automation for Humanitarian Applications,,,,,,Qualis 2017-2020,,,,
CompID901080,RAID,2025,"International Symposium on Research in Attacks, Intrusions, and Defenses",,,,,,Qualis 2017-2020,,,,
CompID901081,RANLP,2025,International Conference on Recent Advances in Natural Language Processing,,,,,,Qualis 2017-2020,,,,
CompID901082,RCAR,2025,IEEE International Conference on Real-time Computing and Robotics,,,,,,Qualis 2017-2020,,,,
CompID901083,RCIS,2025,International Conference on Research Challenges in Information Science,,,,,,Qualis 2017-2020,,,,
CompID901084,RE,2025,IEEE International Requirements Engineering Conference,,,,,,Qualis 2017-2020,,,,
CompID901085,REBLS,2025,Workshop on Reactive and Event-Based Languages and Systems,,,,,,Qualis 2017-2020,,,,
CompID901086,RECOMB,2025,International Conference on Research in Computational Molecular Biology,,,,,,Qualis 2017-2020,,,,
CompID901087,RECONFIG,2025,International Conference on Reconfigurable Computing and FPGAs,,,,,,Qualis 2017-2020,,,,
CompID901088,RECOSOC,2025,International Symposium on Reconfigurable Communication-centric Systems-on-Chip,,,,,,Qualis 2017-2020,,,,
CompID901089,RECSYS,2025,ACM Conference on Recommender Systems,,,,,,Qualis 2017-2020,,,,
CompID901090,REFSQ,2025,International Working Conference on Requirements Engineering: Foundations for Software Quality,,,,,,Qualis 2017-2020,,,,
CompID901091,RICE,2025,International Conference on Research in Intelligent and Computing in Engineering,,,,,,Qualis 2017-2020,,,,
CompID901092,RITA,2025,International Conference on Robot Intelligence Technology and Applications,,,,,,Qualis 2017-2020,,,,
CompID901093,RO-MAN,2025,IEEE International Symposium on Robot and Human Interactive Communication,,,,,,Qualis 2017-2020,,,,
CompID901094,ROBIO,2025,IEEE International Conference on Robotics and Biomimetics,,,,,,Qualis 2017-2020,,,,
CompID901095,ROBOCUP,2025,Robocup International Symposium,,,,,,Qualis 2017-2020,,,,
CompID901096,RoboSoft,2025,IEEE International Conference on Soft Robotics,,,,,,Qualis 2017-2020,,,,
CompID901097,ROBOT,2025,Iberian Robotics Conference,,,,,,Qualis 2017-2020,,,,
CompID901098,RoMoCo,2025,International Workshop on Robot Motion and Control,,,,,,Qualis 2017-2020,,,,
CompID901099,ROOTS,2025,Reversing and Offensive-Oriented Trends Symposium,,,,,,Qualis 2017-2020,,,,
CompID901100,ROSE,2025,IEEE International Symposium on Robotic and Sensors Environments,,,,,,Qualis 2017-2020,,,,
CompID901101,RSP,2025,IEEE International Symposium on Rapid System Prototyping,,,,,,Qualis 2017-2020,,,,
CompID901102,RSS,2025,Robotics: Science and Systems,,,,,,Qualis 2017-2020,,,,
CompID901103,RTAS,2025,IEEE REAL-TIME AND EMBEDDED TECHNOLOGY AND APPLICATIONS SYMPOSIUM,,,,,,Qualis 2017-2020,,,,
CompID901104,RTCSA,2025,International Conference on Embedded and Real-Time Computing Systems and Applications,,,,,,Qualis 2017-2020,,,,
CompID901105,RTIS,2025,International Conference on Real Time Intelligent Systems,,,,,,Qualis 2017-2020,,,,
CompID901106,RTSS,2025,Real-Time Systems Symposium,,,,,,Qualis 2017-2020,,,,
CompID901107,RuleML+RR,2025,International Joint Conference on Rules and Reasoning,,,,,,Qualis 2017-2020,,,,
CompID901108,S&P,2025,IEEE Symposium on Security and Privacy,,,,,,Qualis 2017-2020,,,,
CompID901109,SAC,2025,ACM Symposium on Applied Computing,,,,,,Qualis 2017-2020,,,,
CompID901110,SACI,2025,IEEE International Symposium on Applied Computational Intelligence and Informatics,,,,,,Qualis 2017-2020,,,,
CompID901111,SACMAT,2025,ACM Symposium on Access Control Models and Technologies,,,,,,Qualis 2017-2020,,,,
CompID901112,SACRYPT,2025,Workshop on Selected Areas in Cryptography,,,,,,Qualis 2017-2020,,,,
CompID901113,SAFECOMP,2025,"International Conference on Computer Safety, Reliability, and Security",,,,,,Qualis 2017-2020,,,,
CompID901114,SAMOS,2025,"International Conference on Embedded Computer Systems: Architectures, Modeling and Simulation",,,,,,Qualis 2017-2020,,,,
CompID901115,SANER,2025,"IEEE International Conference on Software Analysis, Evolution and Reengineering",,,,,,Qualis 2017-2020,,,,
CompID901116,SARNOFF,2025,IEEE Sarnoff Symposium,,,,,,Qualis 2017-2020,,,,
CompID901117,SAS,2025,IEEE Sensors Applications Symposium,,,,,,Qualis 2017-2020,,,,
CompID901118,SAST,2025,Brazilian Symposium on Systematic and Automated Software Testing,,,,,,Qualis 2017-2020,,,,
CompID901119,SAT,2025,International Conference on Theory and Applications of Satisfiability Testing,,,,,,Qualis 2017-2020,,,,
CompID901120,SBAC-PAD,2025,International Symposium on Computer Architecture and High Performance Computing,,,,,,Qualis 2017-2020,,,,
CompID901121,SBACPADW,2025,International Symposium on Computer Architecture and High Performance Computing Workshop,,,,,,Qualis 2017-2020,,,,
CompID901122,SBAI,2025,Simpósio Brasileiro de Automação Inteligente,,,,,,Qualis 2017-2020,,,,
CompID901123,SBBD,2025,Simpósio Brasileiro de Banco de Dados,,,,,,Qualis 2017-2020,,,,
CompID901124,SBCARS,2025,"Brazilian Symposium on Components, Architectures and Reuse Software",,,,,,Qualis 2017-2020,,,,
CompID901125,SBCAS,2025,Simpósio Brasileiro de Computação Aplicada à Saúde,,,,,,Qualis 2017-2020,,,,
CompID901126,SBCCI,2025,Symposium on Integrated Circuits and Systems Design,,,,,,Qualis 2017-2020,,,,
CompID901127,SBCM,2025,Simpósio Brasileiro de Computação Musical,,,,,,Qualis 2017-2020,,,,
CompID901128,SBCUP,2025,Simpósio Brasileiro de Computação Ubíqua e Pervasiva,,,,,,Qualis 2017-2020,,,,
CompID901129,SBES,2025,Brazilian Symposium on Software Engineering,,,,,,Qualis 2017-2020,,,,
CompID901130,SBESC,2025,Brazilian Symposium on Computing Systems Engineering,,,,,,Qualis 2017-2020,,,,
CompID901131,SBGAMES,2025,Simpósio Brasileiro de Jogos e Entretenimento Digital,,,,,,Qualis 2017-2020,,,,
CompID901132,SBIAGRO,2025,Congresso Brasileiro de Agroinformática,,,,,,Qualis 2017-2020,,,,
CompID901133,SBIE,2025,Simpósio Brasileiro de Informática na Educação,,,,,,Qualis 2017-2020,,,,
CompID901134,SBLP,2025,Brazilian Symposium on Programming Languages,,,,,,Qualis 2017-2020,,,,
CompID901135,SBMF,2025,Brazilian Symposium on Formal Methods,,,,,,Qualis 2017-2020,,,,
CompID901136,SBMICRO,2025,Symposium on Microelectronics Technology and Devices,,,,,,Qualis 2017-2020,,,,
CompID901137,SBPO,2025,Simpósio Brasileiro de Pesquisa Operacional,,,SOBRAPO,,,Qualis 2017-2020,,,,
CompID901138,SBQS,2025,Simpósio Brasileiro de Qualidade de Software,,,,,,Qualis 2017-2020,,,,
CompID901139,SBRC,2025,Simpósio Brasileiro de Redes de Computadores e Sistemas Distribuídos,,,,,,Qualis 2017-2020,,,,
CompID901140,SBrT,2025,Simpósio Brasileiro de Telecomunicações e Processamento de Sinais,,,,,,Qualis 2017-2020,,,,
CompID901141,SBSC,2025,Simpósio Brasileiro de Sistemas Colaborativos,,,,,,Qualis 2017-2020,,,,
CompID901142,SBSeg,2025,Simpósio Brasileiro de Segurança da Informação e de Sistemas Computacionais,,,,,,Qualis 2017-2020,,,,
CompID901143,SBSI,2025,Simpósio Brasileiro de Sistemas de Informação,,,,,,Qualis 2017-2020,,,,
CompID901144,SBSR,2025,Simpósio Brasileiro de Sensoriamento Remoto,,,,,,Qualis 2017-2020,,,,
CompID901145,SBTI,2025,Simpósio Brasileiro de Tecnologia da Informação,,,,,,Qualis 2017-2020,,,,
CompID901146,SC,2025,"International Conference for High Performance Computing, Networking, Storage and Analysis",,,,,,Qualis 2017-2020,,,,
CompID901147,SCA,2025,ACM SIGGRAPH/Eurographics Symposium on Computer Animation,,,,,,Qualis 2017-2020,,,,
CompID901148,SCAM,2025,IEEE International Working Conference on Source Code Analysis and Manipulation,,,,,,Qualis 2017-2020,,,,
CompID901149,SCCTSA,2025,"International Workshop on Smart City Clouds: Technologies, Systems and Applications",,,,,,Qualis 2017-2020,,,,
CompID901150,SciVis,2025,IEEE Scientific Visualization,,,,,,Qualis 2017-2020,,,,
CompID901151,SCOPES,2025,Software and Compilers for Embedded Systems,,,,,,Qualis 2017-2020,,,,
CompID901152,SDM,2025,SIAM International Conference on Data Mining,,,,,,Qualis 2017-2020,,,,
CompID901153,SDPC,2025,"International Conference on Sensing, Diagnostics, Prognostics, and Control",,,,,,Qualis 2017-2020,,,,
CompID901154,SDS,2025,International Conference on Software Defined Systems,,,,,,Qualis 2017-2020,,,,
CompID901155,SE4Science,2025,International Workshop on Software Engineering for Science,,,,,,Qualis 2017-2020,,,,
CompID901156,SEA,2025,International Symposium on Experimental Algorithms,,,,,,Qualis 2017-2020,,,,
CompID901157,SEAA,2025,Euromicro Conference on Software Engineering and Advanced Applications,,,,,,Qualis 2017-2020,,,,
CompID901158,SeAC,2025,Workshop on Self-Aware Computing,,,,,,Qualis 2017-2020,,,,
CompID901159,SEAMS,2025,International Symposium on Software Engineering for Adaptive and Self-Managing Systems,,,,,,Qualis 2017-2020,,,,
CompID901160,SEC,2025,International Conference on ICT Systems Security and Privacy Protection,,,,,,Qualis 2017-2020,,,,
CompID901161,SeCoGis,2025,International Workshop on Semantic and Conceptual Issues in Geographic Information Systems,,,,,,Qualis 2017-2020,,,,
CompID901162,SECON,2025,"IEEE International Conference on Sensing, Communication and Networking",,,,,,Qualis 2017-2020,,,,
CompID901163,SECRYPT,2025,International Conference on Security and Cryptography,,,,,,Qualis 2017-2020,,,,
CompID901164,SEFM,2025,International Conference on Software Engineering and Formal Methods,,,,,,Qualis 2017-2020,,,,
CompID901165,SEGAH,2025,International Conference on Serious Games and Applications for Health,,,,,,Qualis 2017-2020,,,,
