Cites,Authors,Title,Year,Source,Publisher,ArticleURL,CitesURL,GSRank,QueryDate,Type,DOI,ISSN,CitationURL,Volume,Issue,StartPage,EndPage,ECC,CitesPerYear,CitesPerAuthor,AuthorCount,Age,Abstract,FullTextURL,RelatedURL
0,"Lorenzo Natale, Renata Pelissari, FELIPE TURATTI LEONE","Gestão de riscos no fornecimento de matéria-prima em uma indústria química por meio da aplicação de métodos de tomada de decisão",2024,"Anais do Simpósio Brasileiro de Pesquisa Operacional","Galoa","https://doi.org/10.59254/sbpo-2024-193376","",172,"2025-09-04 18:47:44","proceedings-article","10.59254/sbpo-2024-193376","2965-1476","",,,,,0,0.00,0,3,1,"","",""
0,"João Pedro Mauad Nogueira, Gilberto Reynoso Meza","OPTIMIZED ENSEMBLED CONCEPT DRIFT DETECTION",2024,"Anais do Simpósio Brasileiro de Pesquisa Operacional","Galoa","https://doi.org/10.59254/sbpo-2024-193497","",173,"2025-09-04 18:47:44","proceedings-article","10.59254/sbpo-2024-193497","2965-1476","",,,,,0,0.00,0,2,1,"","",""
0,"Yerlis Valdelamar Gonzalez, Leandro Fragroso, Vothan Salomao, Washington Alves de Oliveira, Priscila Berbert Rampazzo","MODELING THE DISTRIBUTION OF MAMMOGRAPHY SCREENINGS USING A MULTI-OBJECTIVE APPROACH",2024,"Anais do Simpósio Brasileiro de Pesquisa Operacional","Galoa","https://doi.org/10.59254/sbpo-2024-193387","",174,"2025-09-04 18:47:44","proceedings-article","10.59254/sbpo-2024-193387","2965-1476","",,,,,0,0.00,0,5,1,"","",""
0,"Tainara Ribeiro Silverio, Arsênio Martins Gomes Neto, Carolayne de Paula Ferreira Mota, Jônatas Araújo de Almeida","ANÁLISE DE DECISÃO MULTICRITÉRIO PARA SELEÇÃO DE FORNECEDORES E PRESTADORES DE SERVIÇO NO SETOR DA MANUTENÇÃO UTILIZANDO O MÉTODO PROMETHEE ROC",2024,"Anais do Simpósio Brasileiro de Pesquisa Operacional","Galoa","https://doi.org/10.59254/sbpo-2024-193788","",175,"2025-09-04 18:47:44","proceedings-article","10.59254/sbpo-2024-193788","2965-1476","",,,,,0,0.00,0,4,1,"","",""
0,"Hélder Silva Ferreira, Rian Pinheiro","Algoritmo ILS-VND para o Problema da Interseção Máxima de k-Subconjuntos",2024,"Anais do Simpósio Brasileiro de Pesquisa Operacional","Galoa","https://doi.org/10.59254/sbpo-2024-193573","",176,"2025-09-04 18:47:44","proceedings-article","10.59254/sbpo-2024-193573","2965-1476","",,,,,0,0.00,0,2,1,"","",""
0,"Tháyna A. Vieira Lúcio, José Arnaldo Barra Montevechi, Rafael de Carvalho Miranda, Jonathan Lúcio, Guilherme Ferreira Lopes","ANÁLISE ESTATÍSTICA PARA PREVISÃO DE PARADAS NÃO PROGRAMADAS EM UMA CÉLULA DE FUNDIÇÃO",2024,"Anais do Simpósio Brasileiro de Pesquisa Operacional","Galoa","https://doi.org/10.59254/sbpo-2024-193513","",177,"2025-09-04 18:47:44","proceedings-article","10.59254/sbpo-2024-193513","2965-1476","",,,,,0,0.00,0,5,1,"","",""
0,"Robson Pires Borges, Heitor Nunes Costa, Dario José Aloise, Fábio Francisco da Costa Fontes, Andréa Cynthia Santos, Josicleyton Azevedo dos Santos","UMA ABORDAGEM PARA O PROBLEMA DA ÁRVORE GERADORA MÍNIMA COM RESTRIÇÃO DE DIÂMETRO VIA METAHEURÍSTICA BRKGA",2024,"Anais do Simpósio Brasileiro de Pesquisa Operacional","Galoa","https://doi.org/10.59254/sbpo-2024-193460","",178,"2025-09-04 18:47:44","proceedings-article","10.59254/sbpo-2024-193460","2965-1476","",,,,,0,0.00,0,6,1,"","",""
0,"Carlos Daniel de Sousa Bezerra, Igor Henrique Leite Cardoso, Carlos Alberto Vasconcelos Bezerra, Flávio Henrique Teles Vieira","Otimização da Área de Cobertura LoRaWAN para Comunicação Robótica R2X Utilizando Controle de Espalhamento Espectral",2024,"Anais do Simpósio Brasileiro de Pesquisa Operacional","Galoa","https://doi.org/10.59254/sbpo-2024-193404","",179,"2025-09-04 18:47:44","proceedings-article","10.59254/sbpo-2024-193404","2965-1476","",,,,,0,0.00,0,4,1,"","",""
0,"João Pedro Gouvêa de Camargo, Leonardo Delarmelina Secchin, André Renato Sales Amaral","O PROBLEMA DE DIMENSIONAMENTO DE LOTES EM UMA LANCHONETE DE SÃO MATEUS-ES",2024,"Anais do Simpósio Brasileiro de Pesquisa Operacional","Galoa","https://doi.org/10.59254/sbpo-2024-193782","",180,"2025-09-04 18:47:44","proceedings-article","10.59254/sbpo-2024-193782","2965-1476","",,,,,0,0.00,0,3,1,"","",""
0,"André Cintas Donizette, Cleber Rocco, Thiago Alves de Queiroz","Predicting Visceral Leishmaniasis Outbreaks in Brazil with Artificial Intelligence Algorithms",2024,"Anais do Simpósio Brasileiro de Pesquisa Operacional","Galoa","https://doi.org/10.59254/sbpo-2024-193605","",181,"2025-09-04 18:47:44","proceedings-article","10.59254/sbpo-2024-193605","2965-1476","",,,,,0,0.00,0,3,1,"","",""
0,"Leonardo Fontolan, Wilson Enrique Chumbi Quito, Jônatas Boás Leite","DETERMINAÇÃO DA LATÊNCIA DE TRANSMISSÃO EM DUAS ARQUITETURAS DE INTERNET DAS COISAS NA DIGITALIZAÇÃO DAS REDES DE DISTRIBUIÇÃO",2024,"Anais do Simpósio Brasileiro de Pesquisa Operacional","Galoa","https://doi.org/10.59254/sbpo-2024-193642","",182,"2025-09-04 18:47:44","proceedings-article","10.59254/sbpo-2024-193642","2965-1476","",,,,,0,0.00,0,3,1,"","",""
0,"Eduardo Machado Silva, Antonio Augusto Chaves","BRKGA com Aprendizado por Reforço para o Problema de p-Centros com alpha-Vizinhos",2024,"Anais do Simpósio Brasileiro de Pesquisa Operacional","Galoa","https://doi.org/10.59254/sbpo-2024-193541","",183,"2025-09-04 18:47:44","proceedings-article","10.59254/sbpo-2024-193541","2965-1476","",,,,,0,0.00,0,2,1,"","",""
0,"Israel Pereira de Souza, Igor Machado Coelho","UMA ANÁLISE DO GRASP COM FILTRO DE BLOOM PARA IMPEDIR EXPLORAÇÃO DE DUPLICATAS APLICADO AO CVRP",2024,"Anais do Simpósio Brasileiro de Pesquisa Operacional","Galoa","https://doi.org/10.59254/sbpo-2024-193325","",184,"2025-09-04 18:47:44","proceedings-article","10.59254/sbpo-2024-193325","2965-1476","",,,,,0,0.00,0,2,1,"","",""
0,"Renata Pelissari, Betania Campello, Maria Celia de Oliveira","UM NOVO MODELO PARA SEGMENTACÃO DE FORNECEDORES: A MATRIZ KRALJIC PROBABILÍSTICA",2024,"Anais do Simpósio Brasileiro de Pesquisa Operacional","Galoa","https://doi.org/10.59254/sbpo-2024-193408","",185,"2025-09-04 18:47:44","proceedings-article","10.59254/sbpo-2024-193408","2965-1476","",,,,,0,0.00,0,3,1,"","",""
0,"Bruno Pereira Diniz, Daniel Augusto de Moura Pereira, Marcos Santos, Arthur Pinheiro de Araújo Costa","ABORDAGEM HÍBRIDA A PARTIR DOS MÉTODOS DE DECISÃO MULTICRITÉRIO MPSI E MABAC PARA ORDENAÇÃO DE PORTA-HELICÓPTEROS PARA A MARINHA DO BRASIL",2024,"Anais do Simpósio Brasileiro de Pesquisa Operacional","Galoa","https://doi.org/10.59254/sbpo-2024-193741","",186,"2025-09-04 18:47:44","proceedings-article","10.59254/sbpo-2024-193741","2965-1476","",,,,,0,0.00,0,4,1,"","",""
0,"Marcello Dantas Gomes Junior, Marcos Santos, Carlos Francisco Simões Gomes, Pauli Adriano de Almada Garcia","ESCOLHA DA ESTRATÉGIA DE MANUTENÇÃO DE UM SISTEMA DE GERAÇÃO DE VAPOR: UMA APLICAÇÃO DO MÉTODO PSI-COCOSO",2024,"Anais do Simpósio Brasileiro de Pesquisa Operacional","Galoa","https://doi.org/10.59254/sbpo-2024-193926","",187,"2025-09-04 18:47:44","proceedings-article","10.59254/sbpo-2024-193926","2965-1476","",,,,,0,0.00,0,4,1,"","",""
0,"Humberto Gimenes Macedo, Camyla Ferreira Moreno","Resolução do Problema de Minimização de Trocas de Ferramentas com uma Busca Local Iterada Baseada em Chaves Aleatórias",2024,"Anais do Simpósio Brasileiro de Pesquisa Operacional","Galoa","https://doi.org/10.59254/sbpo-2024-193916","",188,"2025-09-04 18:47:44","proceedings-article","10.59254/sbpo-2024-193916","2965-1476","",,,,,0,0.00,0,2,1,"","",""
0,"Gislaine Camila de Freitas, Douglas Alem, Mariá Cristina Vasconcelos Nascimento","Otimização da cadeia de suprimentos de ajuda alimentar através da integração de problemas de localização, inventário e roteamento: Uma revisão da literatura",2024,"Anais do Simpósio Brasileiro de Pesquisa Operacional","Galoa","https://doi.org/10.59254/sbpo-2024-193795","",189,"2025-09-04 18:47:44","proceedings-article","10.59254/sbpo-2024-193795","2965-1476","",,,,,0,0.00,0,3,1,"","",""
0,"Mateus Peixoto, Bruno Fânzeres dos Santos, Leonardo Blois","Supply Chain Management in a Weak Dominance Coopetition Environment under Decision-Dependent Uncertainty",2024,"Anais do Simpósio Brasileiro de Pesquisa Operacional","Galoa","https://doi.org/10.59254/sbpo-2024-193870","",190,"2025-09-04 18:47:44","proceedings-article","10.59254/sbpo-2024-193870","2965-1476","",,,,,0,0.00,0,3,1,"","",""
0,"Francisco Eudes Mendes Filho, Pablo Luiz Braga Soares, Isaac Freitas Andrade","Aplicação do algoritmo genético de chaves aleatórias viciadas nos jogos Settlers of Catan e Terra Mystica para geração dos tabuleiros de forma balanceada",2024,"Anais do Simpósio Brasileiro de Pesquisa Operacional","Galoa","https://doi.org/10.59254/sbpo-2024-193844","",191,"2025-09-04 18:47:44","proceedings-article","10.59254/sbpo-2024-193844","2965-1476","",,,,,0,0.00,0,3,1,"","",""
0,"Erico Souza Teixeira, Pâmela Thays Lins Bezerra, Arthur Carlos da Rocha Silva, Marcelo Arcoverde, Gabriel Pires Aquino de Carvalho","EXPANDING JOB SHOP SCHEDULING PROBLEM TO THE CONTEXT OF SERVICE PRIORITIZATION",2024,"Anais do Simpósio Brasileiro de Pesquisa Operacional","Galoa","https://doi.org/10.59254/sbpo-2024-193625","",192,"2025-09-04 18:47:44","proceedings-article","10.59254/sbpo-2024-193625","2965-1476","",,,,,0,0.00,0,5,1,"","",""
0,"Wagner dos Anjos Carvalho, Isabella de Castro Minhaneli, Renato Milhomem de Oliveira Filho, Luana de Azevedo de Oliveira, Marcos Santos, LUIZ PAULO FÁVERO, Carlos Francisco Simões Gomes","Avaliação da eficiência relativa de aviários de alojamento de aves de frango de corte utilizando a Análise por Envoltória de Dados",2024,"Anais do Simpósio Brasileiro de Pesquisa Operacional","Galoa","https://doi.org/10.59254/sbpo-2024-193372","",193,"2025-09-04 18:47:44","proceedings-article","10.59254/sbpo-2024-193372","2965-1476","",,,,,0,0.00,0,7,1,"","",""
0,"Pedro dos Santos Zanelato, Francisco Ferreira Lima Neto, Pedro Paulo Araújo de Paula e Silva, Edna A. Hoshino","Estratégias de pricing para o problema de orientação de times com conjuntos",2024,"Anais do Simpósio Brasileiro de Pesquisa Operacional","Galoa","https://doi.org/10.59254/sbpo-2024-193381","",194,"2025-09-04 18:47:44","proceedings-article","10.59254/sbpo-2024-193381","2965-1476","",,,,,0,0.00,0,4,1,"","",""
0,"Luis Fernando Mujica, Juan Pablo Escobar Vargas, Laura M. Escobar","Automated Graph-Based Methodology for Generating Specialized Cuts for the Long-term Transmission Network Expansion Planning Problem",2024,"Anais do Simpósio Brasileiro de Pesquisa Operacional","Galoa","https://doi.org/10.59254/sbpo-2024-193477","",195,"2025-09-04 18:47:44","proceedings-article","10.59254/sbpo-2024-193477","2965-1476","",,,,,0,0.00,0,3,1,"","",""
0,"Fábio Fernandes Ribeiro, Maria Simone Alves","Mapeamento de gargalos de uma usina de beneficiamento mineral por meio da simulação de eventos discretos e análise de falhas",2024,"Anais do Simpósio Brasileiro de Pesquisa Operacional","Galoa","https://doi.org/10.59254/sbpo-2024-193535","",196,"2025-09-04 18:47:44","proceedings-article","10.59254/sbpo-2024-193535","2965-1476","",,,,,0,0.00,0,2,1,"","",""
0,"Maria Fernanda Oliveira Guimarães, Matheus Liborio, Laura Cozzi Ribeiro, Marcos Flávio Silveira Vasconcelos D'Angelo, Daniel Cirino Martins, Petr Ekel, Hamidreza Rabiei-Dastjerdi, Paulo Fernando Braga Carvalho","O papel da heterogeneidade na definição do índice global de inovação dos países da organização para a cooperação e desenvolvimento económico",2024,"Anais do Simpósio Brasileiro de Pesquisa Operacional","Galoa","https://doi.org/10.59254/sbpo-2024-193781","",197,"2025-09-04 18:47:44","proceedings-article","10.59254/sbpo-2024-193781","2965-1476","",,,,,0,0.00,0,8,1,"","",""
0,"Leonardo Cabral da Rocha Soares, Marco Antonio Moreira Carvalho","Uma nova abordagem rápida e competitiva para o problema de minimização de trocas de ferramentas",2024,"Anais do Simpósio Brasileiro de Pesquisa Operacional","Galoa","https://doi.org/10.59254/sbpo-2024-193410","",198,"2025-09-04 18:47:44","proceedings-article","10.59254/sbpo-2024-193410","2965-1476","",,,,,0,0.00,0,2,1,"","",""
0,"Iasmin Saba, Lisieux Marie Andrade, Luiz Alberto Viana","Análise de Desempenho do Algoritmo Genético e Enxame de Partículas Aplicados Individualmente ao Problema de Otimização de Portfólio",2024,"Anais do Simpósio Brasileiro de Pesquisa Operacional","Galoa","https://doi.org/10.59254/sbpo-2024-193451","",199,"2025-09-04 18:47:44","proceedings-article","10.59254/sbpo-2024-193451","2965-1476","",,,,,0,0.00,0,3,1,"","",""
0,"Vanderlei Pinheiro Correia, Gessica Barbosa Bampi, Sandro César Bortoluzzi","APOIO À DECISÃO MULTICRITÉRIO NA GESTÃO DA EVASÃO EM UMA INSTITUIÇÃO DE ENSINO PROFISSIONALIZANTE",2024,"Anais do Simpósio Brasileiro de Pesquisa Operacional","Galoa","https://doi.org/10.59254/sbpo-2024-193929","",200,"2025-09-04 18:47:44","proceedings-article","10.59254/sbpo-2024-193929","2965-1476","",,,,,0,0.00,0,3,1,"","",""
0,"Joyce Maia, Gisele Dantas, Renata Cristina de Araújo Lima, Katarinne Lucena de Sena, Ricardo Pires de Souza","MODELO MULTICRITÉRIO DE APOIO À DECISÃO PARA ORDENAÇÃO DAS ESPECIALIDADES MÉDICAS A SER INSERIDAS NA REDE PRÓPRIA: ESTUDO DE CASO EM UMA OPERADORA DE PLANOS DE SAÚDE DO RIO GRANDE DO NORTE",2024,"Anais do Simpósio Brasileiro de Pesquisa Operacional","Galoa","https://doi.org/10.59254/sbpo-2024-193752","",201,"2025-09-04 18:47:44","proceedings-article","10.59254/sbpo-2024-193752","2965-1476","",,,,,0,0.00,0,5,1,"","",""
0,"Matheus Costa Pereira, Tiago Martins de Azevedo, Matheus Brendon Francisco, Anderson Paulo de Paiva","Otimização de processos fluidodinâmicos: Integração do Computational Fluid Dynamics com Machine Learning e Meta-heurística",2024,"Anais do Simpósio Brasileiro de Pesquisa Operacional","Galoa","https://doi.org/10.59254/sbpo-2024-193817","",202,"2025-09-04 18:47:44","proceedings-article","10.59254/sbpo-2024-193817","2965-1476","",,,,,0,0.00,0,4,1,"","",""
0,"Anderson Gonçalves Portella, Daniel Augusto de Moura Pereira, Marcos Santos","SELEÇÃO DE CAMINHÕES PARA O TRANSPORTE DE CARGAS NO BRASIL: UMA ABORDAGEM MULTICRITÉRIO UTILIZANDO O MÉTODO HÍBRIDO MEREC WISP-S",2024,"Anais do Simpósio Brasileiro de Pesquisa Operacional","Galoa","https://doi.org/10.59254/sbpo-2024-193910","",203,"2025-09-04 18:47:44","proceedings-article","10.59254/sbpo-2024-193910","2965-1476","",,,,,0,0.00,0,3,1,"","",""
0,"Silvio Hamacher, Pedro Hamacher","VITORIA: RECOMENDANDO A CONTRATAÇÃO DE JOGADORES DE FUTEBOL",2024,"Anais do Simpósio Brasileiro de Pesquisa Operacional","Galoa","https://doi.org/10.59254/sbpo-2024-193534","",204,"2025-09-04 18:47:44","proceedings-article","10.59254/sbpo-2024-193534","2965-1476","",,,,,0,0.00,0,2,1,"","",""
0,"Rafael Gomes Paes de Lira, Gilberto Dênis de Souza Leite Filho, Lucas Matheus do Nascimento, Leandro Henrique  Gomes da Silva, William Formagio, Márcio das Chagas Moura","ESTRATÉGIAS AVANÇADAS DE CONTROLE DE LINHA: UMA ABORDAGEM COM APRENDIZADO POR REFORÇO PROFUNDO",2024,"Anais do Simpósio Brasileiro de Pesquisa Operacional","Galoa","https://doi.org/10.59254/sbpo-2024-193527","",205,"2025-09-04 18:47:44","proceedings-article","10.59254/sbpo-2024-193527","2965-1476","",,,,,0,0.00,0,6,1,"","",""
0,"Aldo Vieira Pinto, Elisangela Martins de Sá, Sérgio Ricardo de Souza","ALGORITMO ILS PARA O PROBLEMA DE LOCALIZAÇÃO DE p-HUBS AVESSO AO RISCO COM ALOCAÇÃO MÚLTIPLA",2024,"Anais do Simpósio Brasileiro de Pesquisa Operacional","Galoa","https://doi.org/10.59254/sbpo-2024-193595","",206,"2025-09-04 18:47:44","proceedings-article","10.59254/sbpo-2024-193595","2965-1476","",,,,,0,0.00,0,3,1,"","",""
0,"Mateus Carvalho da Silva, Rafael Melo, Márcio Costa Santo, Rodrigo Franco Toso, Maurício Guilherme de Carvalho Resende","Formulações de programação inteira para o problema da coloração de Grundy conexa",2024,"Anais do Simpósio Brasileiro de Pesquisa Operacional","Galoa","https://doi.org/10.59254/sbpo-2024-193659","",207,"2025-09-04 18:47:44","proceedings-article","10.59254/sbpo-2024-193659","2965-1476","",,,,,0,0.00,0,5,1,"","",""
0,"José Robério de Castro Ferreira, Leandro Chaves Rêgo","EQUIDADE NA TOMADA DE DECISÃO: UMA NOVA PERSPECTIVA EM DECISÃO MULTICRITÉRIO COM O USO DO MÉTODO AHP-EQUITATIVO",2024,"Anais do Simpósio Brasileiro de Pesquisa Operacional","Galoa","https://doi.org/10.59254/sbpo-2024-193865","",208,"2025-09-04 18:47:44","proceedings-article","10.59254/sbpo-2024-193865","2965-1476","",,,,,0,0.00,0,2,1,"","",""
0,"Anderson Carlos da Silva Morais, Anderson Carlos, Matheus da Silva Menezes","MODELAGEM E SIMULAÇÃO DE DISSEMINAÇÃO DE DOENÇAS BASEADO EM AUTÔMATOS CELULARES",2024,"Anais do Simpósio Brasileiro de Pesquisa Operacional","Galoa","https://doi.org/10.59254/sbpo-2024-193866","",209,"2025-09-04 18:47:44","proceedings-article","10.59254/sbpo-2024-193866","2965-1476","",,,,,0,0.00,0,3,1,"","",""
0,"Luiz Frederico Horácio de S. de B. Teixeira, Michele Ferreira Moreira, Fábio Henrique Martins Queiroz, Miguel Ângelo  Lellis Moreira, Marcos Santos, Igor Pinheiro de Araújo Costa","APLICAÇÃO DO MÉTODO ELECTRE I PARA AQUISIÇÃO DE VENTILADORES MECÂNICOS NÃO INVASIVOS EM UMA OPERADORA DE SAÚDE.",2024,"Anais do Simpósio Brasileiro de Pesquisa Operacional","Galoa","https://doi.org/10.59254/sbpo-2024-193660","",210,"2025-09-04 18:47:44","proceedings-article","10.59254/sbpo-2024-193660","2965-1476","",,,,,0,0.00,0,6,1,"","",""
0,"SÉRGIO MITIHIRO DO NASCIMENTO MAÊDA, Antônio Luiz Carlucio Doneda, Luiz Frederico Horácio de S. de B. Teixeira, Altair Ferreira Filho, Carlos Francisco Simões Gomes","A Simulação nas Forças Armadas: Desafios e Oportunidades para a Marinha do Brasil",2024,"Anais do Simpósio Brasileiro de Pesquisa Operacional","Galoa","https://doi.org/10.59254/sbpo-2024-193919","",211,"2025-09-04 18:47:44","proceedings-article","10.59254/sbpo-2024-193919","2965-1476","",,,,,0,0.00,0,5,1,"","",""
0,"Janaina da Silva Santos, Vivían Sandriny Silva de Andrade, Marina Dantas de Oliveira Duarte","PROBLEMA DE ESCOLHA DO CURSO DE NÍVEL SUPERIOR: UMA ABORDAGEM COMBINADA UTILIZANDO O VALUE FOCUSED THINKING E O PROMETHEE-ROC",2024,"Anais do Simpósio Brasileiro de Pesquisa Operacional","Galoa","https://doi.org/10.59254/sbpo-2024-193568","",212,"2025-09-04 18:47:44","proceedings-article","10.59254/sbpo-2024-193568","2965-1476","",,,,,0,0.00,0,3,1,"","",""
0,"Jonathan Lúcio, Rafael de Carvalho Miranda, José Arnaldo Barra Montevechi, Tháyna A. Vieira Lúcio, Guilherme Ferreira Lopes","APLICAÇÃO DE UM FRAMEWORK PARA CONDUÇÃO DE PROJETOS DE SIMULAÇÃO A EVENTOS DISCRETOS INTEGRANDO LEAN SIX SIGMA",2024,"Anais do Simpósio Brasileiro de Pesquisa Operacional","Galoa","https://doi.org/10.59254/sbpo-2024-193508","",213,"2025-09-04 18:47:44","proceedings-article","10.59254/sbpo-2024-193508","2965-1476","",,,,,0,0.00,0,5,1,"","",""
0,"Tarcísio Barroso Marques, José Elias Claudio Arroyo","ALGORITMO GENÉTICO APLICADO À LOCALIZAÇÃO DE INSTALAÇÕES CAPACITADAS COBERTAS POR DRONES DE ALCANCE LIMITADO",2024,"Anais do Simpósio Brasileiro de Pesquisa Operacional","Galoa","https://doi.org/10.59254/sbpo-2024-193496","",214,"2025-09-04 18:47:44","proceedings-article","10.59254/sbpo-2024-193496","2965-1476","",,,,,0,0.00,0,2,1,"","",""
0,"Brenno Serao, Igor Machado Coelho","A review on multiplicity of methods, criteria and data sources for multicriteria decision making on energy transition environment",2024,"Anais do Simpósio Brasileiro de Pesquisa Operacional","Galoa","https://doi.org/10.59254/sbpo-2024-193428","",215,"2025-09-04 18:47:44","proceedings-article","10.59254/sbpo-2024-193428","2965-1476","",,,,,0,0.00,0,2,1,"","",""
0,"Lucas Assunção, Andréa Cynthia Santos","Um heurística Kernel Search para o problema da orientação de equipes robusto com vértices de Steiner e prioridades decrescentes em função do tempo",2024,"Anais do Simpósio Brasileiro de Pesquisa Operacional","Galoa","https://doi.org/10.59254/sbpo-2024-193896","",216,"2025-09-04 18:47:44","proceedings-article","10.59254/sbpo-2024-193896","2965-1476","",,,,,0,0.00,0,2,1,"","",""
0,"Maria Luiza Xavier de Holanda Cavalcanti, Maria Cecilia Menezes Cleto, Leydiana de Sousa Pereira, José Leão e Silva Filho, Lúcio Camara e Silva","Avaliação do mercado slow fashion utilizando um modelo baseado em emparelhamento estável",2024,"Anais do Simpósio Brasileiro de Pesquisa Operacional","Galoa","https://doi.org/10.59254/sbpo-2024-193374","",217,"2025-09-04 18:47:44","proceedings-article","10.59254/sbpo-2024-193374","2965-1476","",,,,,0,0.00,0,5,1,"","",""
0,"Lucas Felipe Bravim Montebeller, Leandro Resendo","Modelo de Programação Linear Inteira para Otimização do Transporte na Colheita Florestal",2024,"Anais do Simpósio Brasileiro de Pesquisa Operacional","Galoa","https://doi.org/10.59254/sbpo-2024-193635","",218,"2025-09-04 18:47:44","proceedings-article","10.59254/sbpo-2024-193635","2965-1476","",,,,,0,0.00,0,2,1,"","",""
0,"SABRINA OLIVEIRA, Abel Lameque  Silva Damasceno, Damirys Maria Lucena de Lima, Joyce Maia, Ricardo Pires de Souza","MODELO DE TOMADA DE DECISÃO MULTICRITÉRIO DE MEDICAMENTOS E MATERIAIS EM UMA CENTRAL DE ABASTECIMENTO FARMACÊUTICO: UMA APLICAÇÃO DO MÉTODO FITRADEOFF DE CLASSIFICAÇÃO",2024,"Anais do Simpósio Brasileiro de Pesquisa Operacional","Galoa","https://doi.org/10.59254/sbpo-2024-193364","",219,"2025-09-04 18:47:44","proceedings-article","10.59254/sbpo-2024-193364","2965-1476","",,,,,0,0.00,0,5,1,"","",""
0,"GABRIELA HELENA BAUAB SHIGUEMOTO, ANDRE LUIS SHIGUEMOTO, MATHEUS AUGUSTO PAIVA LUZ","PLANEJAMENTO DA EXPANSÃO DE SISTEMAS DE DISTRIBUIÇÃO UTILIZANDO BUSCA TABU",2024,"Anais do Simpósio Brasileiro de Pesquisa Operacional","Galoa","https://doi.org/10.59254/sbpo-2024-193856","",220,"2025-09-04 18:47:44","proceedings-article","10.59254/sbpo-2024-193856","2965-1476","",,,,,0,0.00,0,3,1,"","",""
0,"Caio Henrique De Felice, Ana Letícia Bragança Rodrigues, Gustavo Stabile, Níssia Carvalho Rosa Bergiante, Mischel Carmen Neyra Belderrain, Rafael Paes, Elcio Hideiti Shiguemori","ANALISANDO O IMPACTO DO GARIMPO ILEGAL DE OURO NA TERRA INDÍGENA YANOMAMI EM RORAIMA, BRASIL: UMA ABORDAGEM COM SOFT SYSTEMS METHODOLOGY (SSM)",2024,"Anais do Simpósio Brasileiro de Pesquisa Operacional","Galoa","https://doi.org/10.59254/sbpo-2024-193576","",221,"2025-09-04 18:47:44","proceedings-article","10.59254/sbpo-2024-193576","2965-1476","",,,,,0,0.00,0,7,1,"","",""
0,"João Pedro Mauad Nogueira, Gilberto Reynoso Meza, Eduarda Frej","CHOICE OF REAL ESTATE FOR IT COMPANY USING FITRADEOFF",2024,"Anais do Simpósio Brasileiro de Pesquisa Operacional","Galoa","https://doi.org/10.59254/sbpo-2024-193653","",222,"2025-09-04 18:47:44","proceedings-article","10.59254/sbpo-2024-193653","2965-1476","",,,,,0,0.00,0,3,1,"","",""
0,"Carlos Eduardo José da Silva, Luiz Leduino Salles-Neto, Marcos Santos","ENHANCING INSTRUCTOR SELECTION: A VALUE-FOCUSED PERSPECTIVE IN THE BRAZILIAN AIR FORCE",2024,"Anais do Simpósio Brasileiro de Pesquisa Operacional","Galoa","https://doi.org/10.59254/sbpo-2024-193644","",223,"2025-09-04 18:47:44","proceedings-article","10.59254/sbpo-2024-193644","2965-1476","",,,,,0,0.00,0,3,1,"","",""
0,"Otávio Martins Vasconcelos, Iuri Pereira Lopes, João Flávio de Freitas Almeida","Assessing the efficiency of a public emergency care unit through computer simulation",2024,"Anais do Simpósio Brasileiro de Pesquisa Operacional","Galoa","https://doi.org/10.59254/sbpo-2024-193930","",224,"2025-09-04 18:47:44","proceedings-article","10.59254/sbpo-2024-193930","2965-1476","",,,,,0,0.00,0,3,1,"","",""
0,"Igor Pinheiro de Araújo Costa, Rebeca Menezes Bezerra, Thaís Evelin Santos de Oliveira, Gabriel Custódio Rangel, Victor Benicio Ardilha da Silva Alves, Carlos Francisco Simões Gomes, Marcos Santos","Seleção de Impressoras 3D para Aplicações no Centro de Análises de Sistemas Navais (CASNAV): Uma Abordagem Multicritério Inovadora",2024,"Anais do Simpósio Brasileiro de Pesquisa Operacional","Galoa","https://doi.org/10.59254/sbpo-2024-193769","",225,"2025-09-04 18:47:44","proceedings-article","10.59254/sbpo-2024-193769","2965-1476","",,,,,0,0.00,0,7,1,"","",""
0,"Vladimir Yuri Tasso, Caio Paziani Tomazella, Thiago Mariotti, Maristela Oliveira dos Santos","Modelagem Matemática para a Alocação de Médicos em Unidades de Diagnóstico por Imagem",2024,"Anais do Simpósio Brasileiro de Pesquisa Operacional","Galoa","https://doi.org/10.59254/sbpo-2024-193417","",226,"2025-09-04 18:47:44","proceedings-article","10.59254/sbpo-2024-193417","2965-1476","",,,,,0,0.00,0,4,1,"","",""
0,"GABRIEL EDUARDO CURSINO DA SILVA, Alane Alves Silva","EFICIÊNCIA TÉCNICA DA REDE MUNICIPAL DE PERNAMBUCO: UMA ANÁLISE PARA O 9º ANO DO ENSINO FUNDAMENTAL",2024,"Anais do Simpósio Brasileiro de Pesquisa Operacional","Galoa","https://doi.org/10.59254/sbpo-2024-193611","",227,"2025-09-04 18:47:44","proceedings-article","10.59254/sbpo-2024-193611","2965-1476","",,,,,0,0.00,0,2,1,"","",""
0,"Jorge Moreno Ramirez, Simone de Lima Martins, Yuri Frota","An Exact and Heuristic Approach for the Max-weight Popular Matching",2024,"Anais do Simpósio Brasileiro de Pesquisa Operacional","Galoa","https://doi.org/10.59254/sbpo-2024-193742","",228,"2025-09-04 18:47:44","proceedings-article","10.59254/sbpo-2024-193742","2965-1476","",,,,,0,0.00,0,3,1,"","",""
0,"Vivían Sandriny Silva de Andrade, Janaina da Silva Santos, Daniele Darlane de Souza Lima , Marina Dantas de Oliveira Duarte","POLÍTICAS DE ABASTECIMENTO DE ÁGUA NA ZONA RURAL: UMA ABORDAGEM UTIIZANDO VFT",2024,"Anais do Simpósio Brasileiro de Pesquisa Operacional","Galoa","https://doi.org/10.59254/sbpo-2024-193462","",229,"2025-09-04 18:47:44","proceedings-article","10.59254/sbpo-2024-193462","2965-1476","",,,,,0,0.00,0,4,1,"","",""
