Cites,Authors,Title,Year,Source,Publisher,ArticleURL,CitesURL,GSRank,QueryDate,Type,DOI,ISSN,CitationURL,Volume,Issue,StartPage,EndPage,ECC,CitesPerYear,CitesPerAuthor,AuthorCount,Age,Abstract,FullTextURL,RelatedURL
1,"Gilson Castro, Dimas Cassimiro Nascimento, Bruno Nogueira, Rian Pinheiro, Thyago Nepomuceno","Avaliação da eficiência dos centros integrados de segurança pública de Alagoas: Uma aplicação da análise envoltória de dados",2024,"Anais do Simpósio Brasileiro de Pesquisa Operacional","Galoa","https://doi.org/10.59254/sbpo-2024-193483","",306,"2025-09-04 18:47:44","proceedings-article","10.59254/sbpo-2024-193483","2965-1476","",,,,,1,1.00,0,5,1,"","",""
1,"Alex Fernandes de Souza, Paulo Henrique da Silva Campos, Filipe Alves Neto Verri, Pedro Paulo Balestrassi","MULTIVARIATE ANALYSIS OF VARIANCE IN THE TURNING PROCESS OF AISI H13 STEEL",2024,"Anais do Simpósio Brasileiro de Pesquisa Operacional","Galoa","https://doi.org/10.59254/sbpo-2024-193532","",400,"2025-09-04 18:47:44","proceedings-article","10.59254/sbpo-2024-193532","2965-1476","",,,,,1,1.00,0,4,1,"","",""
1,"Alex Fernandes de Souza, Paulo Henrique da Silva Campos, Filipe Alves Neto Verri, Pedro Paulo Balestrassi","MULTIVARIATE ANALYSIS OF VARIANCE IN THE TURNING PROCESS OF AISI H13 STEEL",2024,"Anais do Simpósio Brasileiro de Pesquisa Operacional","Galoa","https://doi.org/10.59254/sbpo-2024-193532","",401,"2025-09-04 18:47:44","proceedings-article","10.59254/sbpo-2024-193532","2965-1476","",,,,,1,1.00,0,4,1,"","",""
0,"Mateus Carvalho da Silva, Rafael Melo, Christian Elster","Formulação de programação inteira para um problema de consolidação de cargas com frete morto e custos por múltiplas entregas",2024,"Anais do Simpósio Brasileiro de Pesquisa Operacional","Galoa","https://doi.org/10.59254/sbpo-2024-193570","",1,"2025-09-04 18:47:44","proceedings-article","10.59254/sbpo-2024-193570","2965-1476","",,,,,0,0.00,0,3,1,"","",""
0,"Plácido Pinheiro, Evandro Carvalho de Andrade, Luana I. Pinheiro, Pedro G. C. D. Pinheiro, Mirian Caliope D. Pinheiro, Luciano C. Nunes","UM NOVO PARADIGMA PARA O DIAGÓSTICO DE AUTISMO: INTEGRANDO APRENDIZADO DE MÁQUINA E ANÁLISE VERBAL DE DECISÃO",2024,"Anais do Simpósio Brasileiro de Pesquisa Operacional","Galoa","https://doi.org/10.59254/sbpo-2024-193899","",2,"2025-09-04 18:47:44","proceedings-article","10.59254/sbpo-2024-193899","2965-1476","",,,,,0,0.00,0,6,1,"","",""
0,"Edgard Braz Alves, Jorge Amaral Alves, Ronaldo Ribeiro Goldschmidt","Classificação Automatizada de Sinais Radar de Baixa Probabilidade de Interceptação: Uma Abordagem de Aprendizado Profundo Utilizando a Distribuição Smoothed Pseudo Wigner Ville",2024,"Anais do Simpósio Brasileiro de Pesquisa Operacional","Galoa","https://doi.org/10.59254/sbpo-2024-193441","",3,"2025-09-04 18:47:44","proceedings-article","10.59254/sbpo-2024-193441","2965-1476","",,,,,0,0.00,0,3,1,"","",""
0,"Andre Assis de Salles, Vitor Otávio Pontes de Medeiros, Pedro Ivo Paulo da Conceição","Contágio entre as Volatilidades dos Mercados de Grãos Alimentares e o Mercado de Capitais Brasileiro",2024,"Anais do Simpósio Brasileiro de Pesquisa Operacional","Galoa","https://doi.org/10.59254/sbpo-2024-193452","",4,"2025-09-04 18:47:44","proceedings-article","10.59254/sbpo-2024-193452","2965-1476","",,,,,0,0.00,0,3,1,"","",""
0,"Clarisse da Silva Vieira, João Vitor Welerson","MODELOS MATEMÁTICOS NO CONTEXTO DO PROBLEMA DE SEQUENCIAMENTO EM PROJETO COM RESTRIÇÃO DE RECURSO: UM ESTUDO BIBLIOMÉTRICO",2024,"Anais do Simpósio Brasileiro de Pesquisa Operacional","Galoa","https://doi.org/10.59254/sbpo-2024-193895","",5,"2025-09-04 18:47:44","proceedings-article","10.59254/sbpo-2024-193895","2965-1476","",,,,,0,0.00,0,2,1,"","",""
0,"Flávio Chiarello, Gilberto Reynoso Meza, Roberto Zanetti Freire","ANÁLISE DE DESEMPENHO DE TÉCNICAS DE APRENDIZADO DE MÁQUINA NA CLASSIFICAÇÃO DE DANOS OCASIONADOS POR MACACOS-PREGO EM PLANTAÇÕES DE PINUS",2024,"Anais do Simpósio Brasileiro de Pesquisa Operacional","Galoa","https://doi.org/10.59254/sbpo-2024-193805","",6,"2025-09-04 18:47:44","proceedings-article","10.59254/sbpo-2024-193805","2965-1476","",,,,,0,0.00,0,3,1,"","",""
0,"João Victor Soares do Amaral, José Arnaldo Barra Montevechi, Rafael de Carvalho Miranda, Carlos Henrique dos Santos","METAMODELAGEM ADAPTATIVA: Uma Aplicação na Indústria Têxtil",2024,"Anais do Simpósio Brasileiro de Pesquisa Operacional","Galoa","https://doi.org/10.59254/sbpo-2024-193779","",7,"2025-09-04 18:47:44","proceedings-article","10.59254/sbpo-2024-193779","2965-1476","",,,,,0,0.00,0,4,1,"","",""
0,"JiaMin Chen, Antonio Carlos Moretti, Petra Maria Bartmeyer, Kelly Cristina Poldi","Métodos de Pontos Interiores e Análise de Sensibilidade",2024,"Anais do Simpósio Brasileiro de Pesquisa Operacional","Galoa","https://doi.org/10.59254/sbpo-2024-193456","",8,"2025-09-04 18:47:44","proceedings-article","10.59254/sbpo-2024-193456","2965-1476","",,,,,0,0.00,0,4,1,"","",""
0,"Matheus de Almeida Mazieiro, Pedro Guilherme Torres das Neves, Pedro Hokama, Mário César San Felice","Metaheurísticas Evolutivas para o Problema do Caixeiro Viajante com um Ajudante Voador",2024,"Anais do Simpósio Brasileiro de Pesquisa Operacional","Galoa","https://doi.org/10.59254/sbpo-2024-193458","",9,"2025-09-04 18:47:44","proceedings-article","10.59254/sbpo-2024-193458","2965-1476","",,,,,0,0.00,0,4,1,"","",""
0,"Marcio Dantas, Pedro Victor Dantas de Brito, Duan Vilela Ferreira, Ciro Jose Jardim de Figueiredo, Caroline Maria de Miranda Mota","Proposta de uma sistemática para a implantação de parques eólicos offshore",2024,"Anais do Simpósio Brasileiro de Pesquisa Operacional","Galoa","https://doi.org/10.59254/sbpo-2024-193494","",10,"2025-09-04 18:47:44","proceedings-article","10.59254/sbpo-2024-193494","2965-1476","",,,,,0,0.00,0,5,1,"","",""
0,"Mariana Almeida, Luis Filipe Azevedo de Oliveira","MÉTODO HÍBRIDO PARA AVALIAÇÃO DOS CUSTOS OPERACIONAIS DE DISTRIBUIDORAS BRASILEIRAS DE ENERGIA",2024,"Anais do Simpósio Brasileiro de Pesquisa Operacional","Galoa","https://doi.org/10.59254/sbpo-2024-193329","",11,"2025-09-04 18:47:44","proceedings-article","10.59254/sbpo-2024-193329","2965-1476","",,,,,0,0.00,0,2,1,"","",""
0,"ARTHUR ANTHONY DA CUNHA ROMÃO E SILVA, Bruno Motta De Carvalho, Aderson Farias Do Nascimento","Hypocentral Parameter Inversion using Hybrid Grey Wolf Optimizer",2024,"Anais do Simpósio Brasileiro de Pesquisa Operacional","Galoa","https://doi.org/10.59254/sbpo-2024-193823","",12,"2025-09-04 18:47:44","proceedings-article","10.59254/sbpo-2024-193823","2965-1476","",,,,,0,0.00,0,3,1,"","",""
0,"Leiva Casemiro Oliveira, Lenardo Chaves e Silva, Thiago Henrique, Andrea Taborda","PCovid: a multilevel model for prediction and aggravation of COVID-19 cases optimized for teleconsultations",2024,"Anais do Simpósio Brasileiro de Pesquisa Operacional","Galoa","https://doi.org/10.59254/sbpo-2024-193768","",13,"2025-09-04 18:47:44","proceedings-article","10.59254/sbpo-2024-193768","2965-1476","",,,,,0,0.00,0,4,1,"","",""
0,"Igor Albuquerque, Wladimir Araújo Tavares","Algoritmos para o problema da clique máxima com paralelismo de bits",2024,"Anais do Simpósio Brasileiro de Pesquisa Operacional","Galoa","https://doi.org/10.59254/sbpo-2024-193536","",14,"2025-09-04 18:47:44","proceedings-article","10.59254/sbpo-2024-193536","2965-1476","",,,,,0,0.00,0,2,1,"","",""
0,"Victor Amorim Porto Farias, José Leão e Silva Filho, Thárcylla Rebecca Negreiros Clemente","GESTÃO DE INSUMOS PARA MERENDA ESCOLAR UTILIZANDO UMA HEURÍSTICA DE ROTEIRIZAÇÃO DE ENTREGAS",2024,"Anais do Simpósio Brasileiro de Pesquisa Operacional","Galoa","https://doi.org/10.59254/sbpo-2024-193412","",15,"2025-09-04 18:47:44","proceedings-article","10.59254/sbpo-2024-193412","2965-1476","",,,,,0,0.00,0,3,1,"","",""
0,"Marcos Flávio Silveira Vasconcelos D'Angelo, andré coimbra, Otil Santos, Angélica Cidália Gouveia dos Santos, João Mendes, Reginaldo Macedo, Matheus Liborio, Petr Ekel","PROPOSTA DE UM INDICADOR GLOBAL DE QUALIDADE DO SISTEMA PÚBLICO DE SAÚDE MUNICIPAL - IGQSPSM",2024,"Anais do Simpósio Brasileiro de Pesquisa Operacional","Galoa","https://doi.org/10.59254/sbpo-2024-193860","",16,"2025-09-04 18:47:44","proceedings-article","10.59254/sbpo-2024-193860","2965-1476","",,,,,0,0.00,0,8,1,"","",""
0,"Luana de Azevedo de Oliveira, Marcos Santos, Carlos Francisco Simões Gomes, Enderson Luiz Pereira Júnior, Emerson Hissao Kojima","Desenvolvimento de uma ferramenta computacional em linguagem R do método Critério de Markowitz",2024,"Anais do Simpósio Brasileiro de Pesquisa Operacional","Galoa","https://doi.org/10.59254/sbpo-2024-193384","",17,"2025-09-04 18:47:44","proceedings-article","10.59254/sbpo-2024-193384","2965-1476","",,,,,0,0.00,0,5,1,"","",""
0,"Carlos Vinicio Dantas Araújo, Jailon William Bruno Oliveira da Silva, Pablo Luiz Braga Soares, Priscila da Cunha Jácome Vidal","APLICAÇÃO DE REDES ADVERSARIAIS GENERATIVAS NA GERAÇÃO DE DADOS PARA PLATAFORMAS OFFSHORE A SEREM DESCOMISSIONADAS",2024,"Anais do Simpósio Brasileiro de Pesquisa Operacional","Galoa","https://doi.org/10.59254/sbpo-2024-193647","",18,"2025-09-04 18:47:44","proceedings-article","10.59254/sbpo-2024-193647","2965-1476","",,,,,0,0.00,0,4,1,"","",""
0,"Lucas Gabriel de Godoi Arriel, Alex Ribeiro, Valdomiro Roberto Damacedo Neto","Uma Nova Restrição para o Problema Leasing k Median e Algoritmos Baseados em Metaheurísticas e Paralelismo",2024,"Anais do Simpósio Brasileiro de Pesquisa Operacional","Galoa","https://doi.org/10.59254/sbpo-2024-193842","",19,"2025-09-04 18:47:44","proceedings-article","10.59254/sbpo-2024-193842","2965-1476","",,,,,0,0.00,0,3,1,"","",""
0,"Arthur Pinheiro de Araújo Costa, Daniel Augusto de Moura Pereira, Gabriel Pereira de Oliveira Capela, Marcos Santos, e d, Bruno Pereira Diniz","METODOLOGIA DE SELEÇÃO DE NAVIOS DE GUERRA NA ERA MODERNA: UMA AVALIAÇÃO SISTEMÁTICA A PARTIR DOS MÉTODOS MEREC E MAIRCA",2024,"Anais do Simpósio Brasileiro de Pesquisa Operacional","Galoa","https://doi.org/10.59254/sbpo-2024-193750","",20,"2025-09-04 18:47:44","proceedings-article","10.59254/sbpo-2024-193750","2965-1476","",,,,,0,0.00,0,6,1,"","",""
0,"Samuel N. Araújo, João Marcos Brito, Raquel Folz, Rosiane de Freitas, Rudini Sampaio","Jogos Partizan de Convexidade de Grafos",2024,"Anais do Simpósio Brasileiro de Pesquisa Operacional","Galoa","https://doi.org/10.59254/sbpo-2024-193912","",21,"2025-09-04 18:47:44","proceedings-article","10.59254/sbpo-2024-193912","2965-1476","",,,,,0,0.00,0,5,1,"","",""
0,"Anna Caroline  Pacheco Truta, Arsênio Martins Gomes Neto, Hévilla Souza Oliveira, Jônatas Araújo de Almeida","PRIORIZAÇÃO DE PLATAFORMA DE STREAMING: UMA ABORDAGEM MULTICRITÉRIO ATRAVÉS DO MÉTODO PROMETHEE II",2024,"Anais do Simpósio Brasileiro de Pesquisa Operacional","Galoa","https://doi.org/10.59254/sbpo-2024-193745","",22,"2025-09-04 18:47:44","proceedings-article","10.59254/sbpo-2024-193745","2965-1476","",,,,,0,0.00,0,4,1,"","",""
0,"Clarissa Maria Rodrigues Oliveira, Matheus Lopes Bittencourt, Raphael Kramer","UMA ABORDAGEM HEURÍSTICA PARA UM PROBLEMA MULTI-OBJETIVO DE SEQUENCIAMENTO EM MÁQUINAS PARALELAS COM CONSIDERAÇÕES AMBIENTAIS",2024,"Anais do Simpósio Brasileiro de Pesquisa Operacional","Galoa","https://doi.org/10.59254/sbpo-2024-193733","",23,"2025-09-04 18:47:44","proceedings-article","10.59254/sbpo-2024-193733","2965-1476","",,,,,0,0.00,0,3,1,"","",""
0,"Aida Ferreira, Carla Maria Silva, Rebeca Beatriz de Luna Oliveira Silva, Romero Barbosa de Assis, Gilmar Gonçalves de Brito","Nariz Artificial Para Detecção De Gases Oriundos Da Compostagem De Resíduos Sólidos",2024,"Anais do Simpósio Brasileiro de Pesquisa Operacional","Galoa","https://doi.org/10.59254/sbpo-2024-193579","",24,"2025-09-04 18:47:44","proceedings-article","10.59254/sbpo-2024-193579","2965-1476","",,,,,0,0.00,0,5,1,"","",""
0,"André Luís Barroso Almeida, Joubert de Castro Lima, Marco Antonio Moreira Carvalho","REVENIMENTO PARALELO APLICADO AO SEQUENCIAMENTO EM MÁQUINAS FLEXÍVEIS PARALELAS COM RECURSOS COMPARTILHADOS",2024,"Anais do Simpósio Brasileiro de Pesquisa Operacional","Galoa","https://doi.org/10.59254/sbpo-2024-193878","",25,"2025-09-04 18:47:44","proceedings-article","10.59254/sbpo-2024-193878","2965-1476","",,,,,0,0.00,0,3,1,"","",""
0,"Ricardo Lukas de Medeiros França, Maria Regina Ferreira de Araújo, Luciano Carlos Azevedo da Costa, Hugo Harry Frederico Ribeiro Kramer","Otimização da Mistura de Resíduos no Coprocessamento: Um Estudo de Caso em Indústria Cimenteira",2024,"Anais do Simpósio Brasileiro de Pesquisa Operacional","Galoa","https://doi.org/10.59254/sbpo-2024-193744","",26,"2025-09-04 18:47:44","proceedings-article","10.59254/sbpo-2024-193744","2965-1476","",,,,,0,0.00,0,4,1,"","",""
0,"Alexandre Ramalho Alberti, Carlos Renan Lopes Galvao, Ronald Ramos da Silva Oliveira","PROPOSIÇÃO, MODELAGEM MATEMÁTICA E ANÁLISE DE UMA POLÍTICA FLEXÍVEL DE SUBSTITUIÇÃO POR IDADE PARA SISTEMAS TÉCNICOS",2024,"Anais do Simpósio Brasileiro de Pesquisa Operacional","Galoa","https://doi.org/10.59254/sbpo-2024-193673","",27,"2025-09-04 18:47:44","proceedings-article","10.59254/sbpo-2024-193673","2965-1476","",,,,,0,0.00,0,3,1,"","",""
0,"Thaís Evelin Santos de Oliveira, Ana Carolina Vaz de Oliveira, Helena Cruz Dias Lino","A influência dos mecanismos de intuição e racionalidade dos processos decisórios na complementação orçamentária da Marinha do Brasil por Emendas Parlamentares.",2024,"Anais do Simpósio Brasileiro de Pesquisa Operacional","Galoa","https://doi.org/10.59254/sbpo-2024-193531","",28,"2025-09-04 18:47:44","proceedings-article","10.59254/sbpo-2024-193531","2965-1476","",,,,,0,0.00,0,3,1,"","",""
0,"Bruno Santos de Miranda, Priscila Berbert Rampazzo, Akebo Yamakami","DESIGNING AN OPTIMIZATION MODEL TO HANDLE INTEGRATED PEST MANAGEMENT IN SOYBEANS",2024,"Anais do Simpósio Brasileiro de Pesquisa Operacional","Galoa","https://doi.org/10.59254/sbpo-2024-193540","",29,"2025-09-04 18:47:44","proceedings-article","10.59254/sbpo-2024-193540","2965-1476","",,,,,0,0.00,0,3,1,"","",""
0,"Katarinne Lucena de Sena, Karinne Lucena de Sena, Renata Cristina de Araújo Lima, Rafaela de Moura Cassiano Silva, Ricardo Pires de Souza","MODELO MULTICRITÉRIO DE APOIO À DECISÃO PARA LOCALIZAÇÃO DE UM CENTRO PRÓPRIO DE SERVIÇOS AMBULATORIAIS DE UMA EMPRESA DE PLANOS DE SAÚDE",2024,"Anais do Simpósio Brasileiro de Pesquisa Operacional","Galoa","https://doi.org/10.59254/sbpo-2024-193617","",30,"2025-09-04 18:47:44","proceedings-article","10.59254/sbpo-2024-193617","2965-1476","",,,,,0,0.00,0,5,1,"","",""
0,"Reinaldo Padilha, Ana Carolina Borges Monteiro Padilha, Rodrigo Bonacin","Alta Velocidade de Busca de Dados de Vacinação por meio de Algoritmo de Computação Quântica",2024,"Anais do Simpósio Brasileiro de Pesquisa Operacional","Galoa","https://doi.org/10.59254/sbpo-2024-193453","",31,"2025-09-04 18:47:44","proceedings-article","10.59254/sbpo-2024-193453","2965-1476","",,,,,0,0.00,0,3,1,"","",""
0,"Felipe Boschetti, Andrei Braga, Geomar Schreiner, Giancarlo Salton","ANÁLISE DE ATIVOS FINANCEIROS VIA GRAFOS DE MERCADO: UM ESTUDO NO CONTEXTO DA REGIÃO SUL DO BRASIL",2024,"Anais do Simpósio Brasileiro de Pesquisa Operacional","Galoa","https://doi.org/10.59254/sbpo-2024-193427","",32,"2025-09-04 18:47:44","proceedings-article","10.59254/sbpo-2024-193427","2965-1476","",,,,,0,0.00,0,4,1,"","",""
0,"OSCAR DE ALMEIDA MACHADO, MAURI APARECIDO DE OLIVEIRA, ANDRÉ LUIZ GOULART MATOS","A “FRAMEWORK” TO MANAGE REPAIRABLE SUPPLIES USING R- STUDIO SOFTWARE.",2024,"Anais do Simpósio Brasileiro de Pesquisa Operacional","Galoa","https://doi.org/10.59254/sbpo-2024-193875","",33,"2025-09-04 18:47:44","proceedings-article","10.59254/sbpo-2024-193875","2965-1476","",,,,,0,0.00,0,3,1,"","",""
0,"Adilson Vilarinho Terra, Claudio de Souza Rocha Junior, Carlos Francisco Simões Gomes, Marcos Santos","APOIO À TOMADA DE DECISÃO EM UMA REDE VAREJISTA: UMA ABORDAGEM HÍBRIDA ENTRE MACHINE LEARNING NÃO SUPERVISIONADO E APOIO MULTICRITÉRIO À DECISÃO",2024,"Anais do Simpósio Brasileiro de Pesquisa Operacional","Galoa","https://doi.org/10.59254/sbpo-2024-193920","",34,"2025-09-04 18:47:44","proceedings-article","10.59254/sbpo-2024-193920","2965-1476","",,,,,0,0.00,0,4,1,"","",""
0,"Davi Gomes Florencio, Wladimir Araújo Tavares, Fábio Carlos Sousa Dias","Comparação entre formulações de programação inteira para o problema da coloração Grundy",2024,"Anais do Simpósio Brasileiro de Pesquisa Operacional","Galoa","https://doi.org/10.59254/sbpo-2024-193403","",35,"2025-09-04 18:47:44","proceedings-article","10.59254/sbpo-2024-193403","2965-1476","",,,,,0,0.00,0,3,1,"","",""
0,"Felipe Martins Müller, Angelita Pezzi Pasqualon Bridi, Guilherme Weis, Suzianne Miranda Tormann","Comparação de Algoritmos Genéticos Multiobjetivo NSGA-II e RNSGA-II para Otimização de Sequenciamento em Máquinas Paralelas Não-Relacionadas",2024,"Anais do Simpósio Brasileiro de Pesquisa Operacional","Galoa","https://doi.org/10.59254/sbpo-2024-193747","",36,"2025-09-04 18:47:44","proceedings-article","10.59254/sbpo-2024-193747","2965-1476","",,,,,0,0.00,0,4,1,"","",""
0,"Acir de Oliveira Junior, Rodrigo José Pires Ferreira","PROPOSTA DE MODELO MULTICRITÉRIO DE APOIO A DECISÃO NA INVESTIGAÇÃO DE CRIME DE MOEDA FALSA COM BASE NO MÉTODO FITRADEOFF",2024,"Anais do Simpósio Brasileiro de Pesquisa Operacional","Galoa","https://doi.org/10.59254/sbpo-2024-193545","",37,"2025-09-04 18:47:44","proceedings-article","10.59254/sbpo-2024-193545","2965-1476","",,,,,0,0.00,0,2,1,"","",""
0,"THIAGO EDUARDO DOS SANTOS, SHAYANE GONÇALVES VILELA, Antônio Rafael Santana, Heber Fernandes Amaral","Resolução do Problema de Programação de Horários Escolares Usando Busca Local - Uma Revisão de Literatura",2024,"Anais do Simpósio Brasileiro de Pesquisa Operacional","Galoa","https://doi.org/10.59254/sbpo-2024-193614","",38,"2025-09-04 18:47:44","proceedings-article","10.59254/sbpo-2024-193614","2965-1476","",,,,,0,0.00,0,4,1,"","",""
0,"Samuel Santos, Franklina Toledo, Pedro Belin Castellucci","Algoritmos de decomposição de Benders para um problema de roteamento de ônibus escolares",2024,"Anais do Simpósio Brasileiro de Pesquisa Operacional","Galoa","https://doi.org/10.59254/sbpo-2024-193859","",39,"2025-09-04 18:47:44","proceedings-article","10.59254/sbpo-2024-193859","2965-1476","",,,,,0,0.00,0,3,1,"","",""
0,"Davi Otoch Barroso, Napoleão Nepomuceno","UM ALGORITMO DE BUSCA EM VIZINHANÇA COM PROFUNDIDADE VARIÁVEL PARA O PROBLEMA DE ROTEAMENTO DE VEÍCULOS COM COLETAS E ENTREGAS SIMULTÂNEAS",2024,"Anais do Simpósio Brasileiro de Pesquisa Operacional","Galoa","https://doi.org/10.59254/sbpo-2024-193358","",40,"2025-09-04 18:47:44","proceedings-article","10.59254/sbpo-2024-193358","2965-1476","",,,,,0,0.00,0,2,1,"","",""
0,"Carolina Blank, Bruno Fânzeres dos Santos, Gustavo Melo, Fernando Luiz Cyrino Oliveira, Paula Maçaira, Fernando Crescencio, Olavo Bet","Alocação Eficiente de Recursos em um Portfólio de Geração Renovável",2024,"Anais do Simpósio Brasileiro de Pesquisa Operacional","Galoa","https://doi.org/10.59254/sbpo-2024-193537","",41,"2025-09-04 18:47:44","proceedings-article","10.59254/sbpo-2024-193537","2965-1476","",,,,,0,0.00,0,7,1,"","",""
0,"Luiz Henrique Cardoso de Oliveira, Lucas Grossi Vieira Santos, Marcelo Azevedo Costa","A justiça na Ciência dos Dados: aplicação de metodologias para a mitigação de vieses sociais em um modelo de Machine Learning para a Concessão de Crédito",2024,"Anais do Simpósio Brasileiro de Pesquisa Operacional","Galoa","https://doi.org/10.59254/sbpo-2024-193549","",42,"2025-09-04 18:47:44","proceedings-article","10.59254/sbpo-2024-193549","2965-1476","",,,,,0,0.00,0,3,1,"","",""
0,"José Francisco M. Pessanha, Mário Jorge Cardoso de Mendonça, Albert Melo, Amaro Pereira Junior, Luis Alberto Medrano, Francisco José dos Santos Alves, Sidnei Costa Junior","UM MODELO DEA PARA AVALIAÇÃO DOS PROJETOS EÓLICOS OFFSHORE EM LICENCIAMENTO NO IBAMA",2024,"Anais do Simpósio Brasileiro de Pesquisa Operacional","Galoa","https://doi.org/10.59254/sbpo-2024-193559","",43,"2025-09-04 18:47:44","proceedings-article","10.59254/sbpo-2024-193559","2965-1476","",,,,,0,0.00,0,7,1,"","",""
0,"Allyson Aires, Jessyk Daiana Bianconi, Mariana Almeida, Joelton F. Barbosa","Benchmarking de Sustentabilidade: Avaliando a eficiência das Políticas Climáticas no Brasil através da Análise Envoltória de Dados (DEA)",2024,"Anais do Simpósio Brasileiro de Pesquisa Operacional","Galoa","https://doi.org/10.59254/sbpo-2024-193392","",44,"2025-09-04 18:47:44","proceedings-article","10.59254/sbpo-2024-193392","2965-1476","",,,,,0,0.00,0,4,1,"","",""
0,"Murillo Santilli Szvaticsek, Igor de Pádua Dutra, Diogo Landim Simões, Victor Hugo de Almeida Duarte, Mischel Carmen Neyra Belderrain","DESENVOLVIMENTO DE METODOLOGIA DE DISTRIBUIÇÃO DAS SEÇÕES DE TRABALHO DOS INSTRUTORES DE VOO DO 2°/5° GRUPO DE AVIAÇÃO UTILIZANDO SOFT SYSTEMS METHODOLOGY",2024,"Anais do Simpósio Brasileiro de Pesquisa Operacional","Galoa","https://doi.org/10.59254/sbpo-2024-193594","",45,"2025-09-04 18:47:44","proceedings-article","10.59254/sbpo-2024-193594","2965-1476","",,,,,0,0.00,0,5,1,"","",""
0,"Alexandre Mello, Matheus Nohra Haddad, Luiz Satoru Ochi, Pablo Luiz Araújo Munhoz, Igor Machado Coelho","Algoritmo MIG-ALBHW para resolver o Assembly Line Balancing with Hierarchical Worker Assignment",2024,"Anais do Simpósio Brasileiro de Pesquisa Operacional","Galoa","https://doi.org/10.59254/sbpo-2024-193340","",46,"2025-09-04 18:47:44","proceedings-article","10.59254/sbpo-2024-193340","2965-1476","",,,,,0,0.00,0,5,1,"","",""
0,"Bárbara Cristina Fonseca de Souza, José Elias Claudio Arroyo","PLANEJAMENTO DE CAMINHO DE COBERTURA PARA DRONES MINIMIZANDO O CONSUMO DE ENERGIA",2024,"Anais do Simpósio Brasileiro de Pesquisa Operacional","Galoa","https://doi.org/10.59254/sbpo-2024-193533","",47,"2025-09-04 18:47:44","proceedings-article","10.59254/sbpo-2024-193533","2965-1476","",,,,,0,0.00,0,2,1,"","",""
0,"Áleff JONATHAN DA SILVA SOARES DE SOUZA, Leiva Casemiro Oliveira, Paulo Gabriel Gadelha Queiroz, Luiz André Moyses Lima","Metodologia baseada em dados SCADA para identificação de erro de ponto zero e diagnóstico de desalinhamento de guinada (yaw) em aerogeradores",2024,"Anais do Simpósio Brasileiro de Pesquisa Operacional","Galoa","https://doi.org/10.59254/sbpo-2024-193415","",48,"2025-09-04 18:47:44","proceedings-article","10.59254/sbpo-2024-193415","2965-1476","",,,,,0,0.00,0,4,1,"","",""
0,"Willian S. de Almeida, Aline M. C. Martins, Flávio V. C. Martins, Elizabeth F. Wanner, Vinicius Mendonça Novaes","Técnicas de otimização aplicadas à escolha eficiente de grupos familiares para modalidade de cuidado coordenado.",2024,"Anais do Simpósio Brasileiro de Pesquisa Operacional","Galoa","https://doi.org/10.59254/sbpo-2024-193423","",49,"2025-09-04 18:47:44","proceedings-article","10.59254/sbpo-2024-193423","2965-1476","",,,,,0,0.00,0,5,1,"","",""
0,"Anselmo Ramalho Pitombeira Neto, Paulo Ricardo Gorayeb Sucupira Junior, Marcelo Gomes Fossile, Lívia Almada Cruz, Ticiana Linhares Coelho da Silva, José Antonio Fernandes de Macedo","UM MODELO DE PROGRAMAÇÃO LINEAR INTEIRA MISTA BASEADO EM EQUILÍBRIO PARA A ALOCAÇÃO ESPACIAL DE FAMÍLIAS A AGÊNCIAS BANCÁRIAS",2024,"Anais do Simpósio Brasileiro de Pesquisa Operacional","Galoa","https://doi.org/10.59254/sbpo-2024-193578","",50,"2025-09-04 18:47:44","proceedings-article","10.59254/sbpo-2024-193578","2965-1476","",,,,,0,0.00,0,6,1,"","",""
0,"Rodrigo Hermont Ozon, Gilberto Reynoso Meza","COMPARATIVE ANALYSIS OF FUZZY REGRESSION MODELS AND MULTICRITERIA DECISION-MAKING FOR COMMODITY MARKET FORECASTING SCENARIOS",2024,"Anais do Simpósio Brasileiro de Pesquisa Operacional","Galoa","https://doi.org/10.59254/sbpo-2024-193764","",51,"2025-09-04 18:47:44","proceedings-article","10.59254/sbpo-2024-193764","2965-1476","",,,,,0,0.00,0,2,1,"","",""
0,"Rafael Cavalcante Chaves, João Pedro Oliveira Santos, Kerven Maciel Monteiro de Albuquerque, Thiago Gouveia","Métodos de Otimização Aplicados à Detecção de Plágio em Exercícios de Programação na Linguagem C",2024,"Anais do Simpósio Brasileiro de Pesquisa Operacional","Galoa","https://doi.org/10.59254/sbpo-2024-193592","",52,"2025-09-04 18:47:44","proceedings-article","10.59254/sbpo-2024-193592","2965-1476","",,,,,0,0.00,0,4,1,"","",""
0,"Mario Viscardi, ANA CAROLINA SANCHES ZEFERINO, ENEIAS DE SOUZA FREITAS, Angelo Passaro, Níssia Carvalho Rosa Bergiante","Modelagem e Decisão Estratégica em Defesa Aérea: Uma Abordagem via Soft Systems Methodology",2024,"Anais do Simpósio Brasileiro de Pesquisa Operacional","Galoa","https://doi.org/10.59254/sbpo-2024-193824","",53,"2025-09-04 18:47:44","proceedings-article","10.59254/sbpo-2024-193824","2965-1476","",,,,,0,0.00,0,5,1,"","",""
0,"Miguel Ângelo  Lellis Moreira, Maria Teresa Pereira, Luiz Frederico Horácio de S. de B. Teixeira, Carlos Francisco Simões Gomes, Marcos Santos","Estrutura Hierárquica da Soberania Nacional: Análise Multicritério das Variáveis de Política de Defesa Mediante o Método SAPEVO-H²",2024,"Anais do Simpósio Brasileiro de Pesquisa Operacional","Galoa","https://doi.org/10.59254/sbpo-2024-193889","",54,"2025-09-04 18:47:44","proceedings-article","10.59254/sbpo-2024-193889","2965-1476","",,,,,0,0.00,0,5,1,"","",""
