Cites,Authors,Title,Year,Source,Publisher,ArticleURL,CitesURL,GSRank,QueryDate,Type,DOI,ISSN,CitationURL,Volume,Issue,StartPage,EndPage,ECC,CitesPerYear,CitesPerAuthor,AuthorCount,Age,Abstract,FullTextURL,RelatedURL
0,"Otavio Henrique Flaeschen Oliveira, Luiz Satoru Ochi, Luis Resende Silva","MONITORAMENTO DE ALAGAMENTOS EM CIDADES INTELIGENTES: FERRAMENTA OPERACIONAL PARA COLETA DE DADOS E IMAGENS INTEGRANDO CAMERAS, WAZE E PLUVIÔMETROS NO RIO DE JANEIRO",2024,"Anais do Simpósio Brasileiro de Pesquisa Operacional","Galoa","https://doi.org/10.59254/sbpo-2024-193448","",113,"2025-09-04 18:47:44","proceedings-article","10.59254/sbpo-2024-193448","2965-1476","",,,,,0,0.00,0,3,1,"","",""
0,"Diego Santana Ferreira, Henrique Amaro Fernandes, Jônatas Boás Leite","LOCALIZAÇÃO DE FALTAS EM REDES DE DISTRIBUIÇÃO COM GERAÇÃO DISTRIBUÍDA UTILIZANDO TÉCNICAS DE PROGRAMAÇÃO NÃO LINEAR",2024,"Anais do Simpósio Brasileiro de Pesquisa Operacional","Galoa","https://doi.org/10.59254/sbpo-2024-193631","",114,"2025-09-04 18:47:44","proceedings-article","10.59254/sbpo-2024-193631","2965-1476","",,,,,0,0.00,0,3,1,"","",""
0,"Waldomiro Alves Ferreira Neto, Rafael Gomes Nobrega Paiva, Maria Luiza Menelau de Albuquerque Almeida, Lucas Vinicius Aguiar da Silva, Cristiano Alexandre Virginio Cavalcante","Impactos da Degradação Induzida pela Montagem e Desmontagem na Política de Manutenção de Sistemas Multicomponentes com Dependência Estrutural",2024,"Anais do Simpósio Brasileiro de Pesquisa Operacional","Galoa","https://doi.org/10.59254/sbpo-2024-193520","",115,"2025-09-04 18:47:44","proceedings-article","10.59254/sbpo-2024-193520","2965-1476","",,,,,0,0.00,0,5,1,"","",""
0,"Tullio Pires, Celio Manso Azevedo Junior, Marcos Santos, Carlos Francisco Simões Gomes","SELEÇÃO DE OBUSEIROS AUTO-PROPULSADOS: UMA ANÁLISE À LUZ DO MÉTODO MULTICRITÉRIO HÍBRIDO MEREC-SPOTIS",2024,"Anais do Simpósio Brasileiro de Pesquisa Operacional","Galoa","https://doi.org/10.59254/sbpo-2024-193927","",116,"2025-09-04 18:47:44","proceedings-article","10.59254/sbpo-2024-193927","2965-1476","",,,,,0,0.00,0,4,1,"","",""
0,"Rafael M. Barros, Guilherme G. Lage, Ricardo A. L. Rabêlo","Mitigating GHG Emissions of Cleared Active Power Allocations from Fossil-Fueled Thermal Power Plants in Hybrid Electricity Markets by the Optimal Environmental Active/Reactive Dispatch and Lagrange Multiplier Sensitivity Analysis",2024,"Anais do Simpósio Brasileiro de Pesquisa Operacional","Galoa","https://doi.org/10.59254/sbpo-2024-193737","",117,"2025-09-04 18:47:44","proceedings-article","10.59254/sbpo-2024-193737","2965-1476","",,,,,0,0.00,0,3,1,"","",""
0,"João Vitor Maués Dias Carneiro, Rafael Almeida da Costa Schneider, Laura Assis, Sanderson L. Gonzaga de Oliveira, Diego Brandão, Claudio Miceli Farias, Pedro Henrique González","Aprendizado por Reforço em uma Heurística Multi-Centralidades para a Redução de Largura de Banda em Matrizes Esparsas",2024,"Anais do Simpósio Brasileiro de Pesquisa Operacional","Galoa","https://doi.org/10.59254/sbpo-2024-193359","",118,"2025-09-04 18:47:44","proceedings-article","10.59254/sbpo-2024-193359","2965-1476","",,,,,0,0.00,0,7,1,"","",""
0,"Braully Rocha da Silva, Erika Morais Martins Coelho, Hebert Coelho da Silva","P3-Carathéodory em Grafos Circulantes",2024,"Anais do Simpósio Brasileiro de Pesquisa Operacional","Galoa","https://doi.org/10.59254/sbpo-2024-193668","",119,"2025-09-04 18:47:44","proceedings-article","10.59254/sbpo-2024-193668","2965-1476","",,,,,0,0.00,0,3,1,"","",""
0,"Victor Benicio Ardilha da Silva Alves, Gabriel Custódio Rangel, Luiz Frederico Horácio de S. de B. Teixeira, Igor Pinheiro de Araújo Costa","A Relevância do Controle da Taxa de Descobertas Falsas em Ambientes de Dados Manipuláveis Aplicações Militares no SisGAAz",2024,"Anais do Simpósio Brasileiro de Pesquisa Operacional","Galoa","https://doi.org/10.59254/sbpo-2024-193351","",120,"2025-09-04 18:47:44","proceedings-article","10.59254/sbpo-2024-193351","2965-1476","",,,,,0,0.00,0,4,1,"","",""
0,"Lucas Andery Reis, Thomas Vargas Barsante e Pinto, Marcone Jamilson Freitas Souza, Luciano Perdigão Cota","Um algoritmo heurístico para o sequenciamento de tripper car em usinas de minério de ferro",2024,"Anais do Simpósio Brasileiro de Pesquisa Operacional","Galoa","https://doi.org/10.59254/sbpo-2024-193669","",121,"2025-09-04 18:47:44","proceedings-article","10.59254/sbpo-2024-193669","2965-1476","",,,,,0,0.00,0,4,1,"","",""
0,"Luyza Ellen Domingos do Nascimento, David Pereira Galvão Júnior, Gilberto Farias de Sousa Filho, Lucidio dos Anjos Formiga Cabral","Agrupamento por interseção de conjuntos para identificação de spam em emails",2024,"Anais do Simpósio Brasileiro de Pesquisa Operacional","Galoa","https://doi.org/10.59254/sbpo-2024-193787","",122,"2025-09-04 18:47:44","proceedings-article","10.59254/sbpo-2024-193787","2965-1476","",,,,,0,0.00,0,4,1,"","",""
0,"Roberto Gomes Ribeiro, Martín Gómez Ravetti, Frederico Gadelha Guimarãres","Programação linear inteira mista. Roteamento de drones e veículos terrestres. Monitoramento de inundações em centros urbanos.",2024,"Anais do Simpósio Brasileiro de Pesquisa Operacional","Galoa","https://doi.org/10.59254/sbpo-2024-193521","",123,"2025-09-04 18:47:44","proceedings-article","10.59254/sbpo-2024-193521","2965-1476","",,,,,0,0.00,0,3,1,"","",""
0,"Felipe Müller, Vanessa Andréia Schneider, Vinicius Jacques Garcia, Claudio Roberto Scheer Júnior, Scheila Daiana Severo Hollveg","Automated Planning and Scheduling: aplicação na cadeia de suprimentos de produtos lácteos",2024,"Anais do Simpósio Brasileiro de Pesquisa Operacional","Galoa","https://doi.org/10.59254/sbpo-2024-193432","",124,"2025-09-04 18:47:44","proceedings-article","10.59254/sbpo-2024-193432","2965-1476","",,,,,0,0.00,0,5,1,"","",""
0,"Bruno Alberto Soares Oliveira, Marcos Alves, Daniel Calvo, Eugenio Daher, Ana Paula Santos, Douglas Ferreira, Osmar Júnior","ANÁLISE SEGMENTADA DE DESCARGAS ATMOSFÉRICAS PARA GERAÇÃO ANTECIPADA DE ALERTAS DE SEGURANÇA EM ÁREAS COM ATIVIDADES EM CAMPO ABERTO",2024,"Anais do Simpósio Brasileiro de Pesquisa Operacional","Galoa","https://doi.org/10.59254/sbpo-2024-193904","",125,"2025-09-04 18:47:44","proceedings-article","10.59254/sbpo-2024-193904","2965-1476","",,,,,0,0.00,0,7,1,"","",""
0,"Plácido Pinheiro, Italo Salomão, Matheus Martins Palmela B. de O. Oliveira","OTIMIZAÇÃO NO CUSTO DE FUNDAÇÕES TRAPEZOIDAIS EM CONCRETO ARMADO",2024,"Anais do Simpósio Brasileiro de Pesquisa Operacional","Galoa","https://doi.org/10.59254/sbpo-2024-193846","",126,"2025-09-04 18:47:44","proceedings-article","10.59254/sbpo-2024-193846","2965-1476","",,,,,0,0.00,0,3,1,"","",""
0,"Candace Q. A. Vasconcelos Pin, Diogo Sevilha Couto, Eduardo Bouhid Neto, Guilherme Freitas Coelho, Luiz Leduino Salles-Neto, Tales Massarin Figueiredo, Wagner dos Anjos Carvalho","EMPACOTAMENTO EFICIENTE NO VAREJO DE MODA: O CASO DAS LOJAS RENNER",2024,"Anais do Simpósio Brasileiro de Pesquisa Operacional","Galoa","https://doi.org/10.59254/sbpo-2024-193632","",127,"2025-09-04 18:47:44","proceedings-article","10.59254/sbpo-2024-193632","2965-1476","",,,,,0,0.00,0,7,1,"","",""
0,"Felipe Whitaker, Fernando Luiz Cyrino Oliveira, Marley Vellasco","Previsão de Velocidade do Vento com Redes Convolucionais",2024,"Anais do Simpósio Brasileiro de Pesquisa Operacional","Galoa","https://doi.org/10.59254/sbpo-2024-193523","",128,"2025-09-04 18:47:44","proceedings-article","10.59254/sbpo-2024-193523","2965-1476","",,,,,0,0.00,0,3,1,"","",""
0,"Anny Carolyny Barbosa Santos da Silva, Maria Letícia Alves de Oliveira Silva, Arsênio Martins Gomes Neto, Hévilla Souza Oliveira, Jônatas Araújo de Almeida","PRIORIZAÇÃO DE GRÃO DE CAFÉ EM UMA CAFETERIA: UMA ABORDAGEM MULTICRITÉRIO ATRAVÉS DO MÉTODO PROMETHEE ROC",2024,"Anais do Simpósio Brasileiro de Pesquisa Operacional","Galoa","https://doi.org/10.59254/sbpo-2024-193793","",129,"2025-09-04 18:47:44","proceedings-article","10.59254/sbpo-2024-193793","2965-1476","",,,,,0,0.00,0,5,1,"","",""
0,"Rafael M. Barros, Guilherme G. Lage, Ricardo A. L. Rabêlo","Modelagem e Resolução do Problema de Despacho Reativo Ótimo Incorporando Sequenciamentos Operacionais Estritamente Factíveis dos Ajustes nas Variáveis de Decisão por Teoria de Grafos e Otimização por Enxame de Partículas",2024,"Anais do Simpósio Brasileiro de Pesquisa Operacional","Galoa","https://doi.org/10.59254/sbpo-2024-193762","",130,"2025-09-04 18:47:44","proceedings-article","10.59254/sbpo-2024-193762","2965-1476","",,,,,0,0.00,0,3,1,"","",""
0,"Fábio Pires Mourão, Marcone Jamilson Freitas Souza, Elisangela Martins de Sá, Sérgio Ricardo de Souza","UM ALGORITMO BUSCA TABU PARA O PROBLEMA CAPACITADO DE LOCALIZAÇÃO DE FACILIDADES COM COBERTURA PARCIAL E FONTE ÚNICA",2024,"Anais do Simpósio Brasileiro de Pesquisa Operacional","Galoa","https://doi.org/10.59254/sbpo-2024-193587","",131,"2025-09-04 18:47:44","proceedings-article","10.59254/sbpo-2024-193587","2965-1476","",,,,,0,0.00,0,4,1,"","",""
0,"Lucas Queiroz Melo da Costa, Carlos Henrique Costa Ribeiro","A study of networks for decision support in neadjuvant treatment for gastric cancer",2024,"Anais do Simpósio Brasileiro de Pesquisa Operacional","Galoa","https://doi.org/10.59254/sbpo-2024-193892","",132,"2025-09-04 18:47:44","proceedings-article","10.59254/sbpo-2024-193892","2965-1476","",,,,,0,0.00,0,2,1,"","",""
0,"Heitor Cordeiro, Níssia Carvalho Rosa Bergiante","ENTENDENDO A DINÂMICA CLIMÁTICA E SUA ASSOCIAÇÃO COM A DENGUE: UM ESTUDO DE DADOS NOS MUNICÍPIOS DO RIO DE JANEIRO",2024,"Anais do Simpósio Brasileiro de Pesquisa Operacional","Galoa","https://doi.org/10.59254/sbpo-2024-193807","",133,"2025-09-04 18:47:44","proceedings-article","10.59254/sbpo-2024-193807","2965-1476","",,,,,0,0.00,0,2,1,"","",""
0,"Henrique José dos Santos Ferreira Júnior, Daniel Ratton Figueiredo","MODEL FORMULATION AND SOLUTION FRAMEWORK FOR THE OPTIMAL BREEDING PROBLEM IN THE AXIE INFINITY GAME",2024,"Anais do Simpósio Brasileiro de Pesquisa Operacional","Galoa","https://doi.org/10.59254/sbpo-2024-193862","",134,"2025-09-04 18:47:44","proceedings-article","10.59254/sbpo-2024-193862","2965-1476","",,,,,0,0.00,0,2,1,"","",""
0,"Danillo Marcus Farias Marinho do Monte, Marcos Santos, Ronaldo Ribeiro Goldschmidt, Ricardo Choren Noya, Daniel Augusto de Moura Pereira","UTILIZAÇÃO DO MÉTODO HÍBRIDO D-CRITIC – COCOSO NA ORDENAÇÃO DE UMA REDE NEURAL PARA CLASSIFICAÇÃO DE IMAGENS",2024,"Anais do Simpósio Brasileiro de Pesquisa Operacional","Galoa","https://doi.org/10.59254/sbpo-2024-193593","",135,"2025-09-04 18:47:44","proceedings-article","10.59254/sbpo-2024-193593","2965-1476","",,,,,0,0.00,0,5,1,"","",""
0,"Victor Hugo Resende Lima, Augusto José da Silva Rodrigues, Rafael Gomes Nobrega Paiva, Hanser Steven Jiménez González, Cristiano Alexandre Virginio Cavalcante","Uma política de inspeções sequenciais e substituição preventiva para componentes heterogêneos",2024,"Anais do Simpósio Brasileiro de Pesquisa Operacional","Galoa","https://doi.org/10.59254/sbpo-2024-193469","",136,"2025-09-04 18:47:44","proceedings-article","10.59254/sbpo-2024-193469","2965-1476","",,,,,0,0.00,0,5,1,"","",""
0,"Amanda Ferreira de Azevedo, Almir Antônio Monteiro Júnior, Vanessa de Almeida Guimarães, Laura Bahiense, Pedro Henrique González","Optimization of Olympic Game-Watching Schedules: A Socioeconomic Analysis for Paris 2024",2024,"Anais do Simpósio Brasileiro de Pesquisa Operacional","Galoa","https://doi.org/10.59254/sbpo-2024-193547","",137,"2025-09-04 18:47:44","proceedings-article","10.59254/sbpo-2024-193547","2965-1476","",,,,,0,0.00,0,5,1,"","",""
0,"Thiago Dias Barcelos, Tatianna Beneteli, Luciano Perdigão Cota","O problema de minimização do deslocamento de operadores em rotas de inspeção: Um estudo de caso",2024,"Anais do Simpósio Brasileiro de Pesquisa Operacional","Galoa","https://doi.org/10.59254/sbpo-2024-193928","",138,"2025-09-04 18:47:44","proceedings-article","10.59254/sbpo-2024-193928","2965-1476","",,,,,0,0.00,0,3,1,"","",""
0,"Felipe Whitaker, Rafaela Moreira de Azevedo Ribeiro, Raphael Bittencourt, Fernando Luiz Cyrino Oliveira","Exploração de Técnicas para Previsão da Velocidade do Vento no Longo prazo",2024,"Anais do Simpósio Brasileiro de Pesquisa Operacional","Galoa","https://doi.org/10.59254/sbpo-2024-193675","",139,"2025-09-04 18:47:44","proceedings-article","10.59254/sbpo-2024-193675","2965-1476","",,,,,0,0.00,0,4,1,"","",""
0,"Jahir Llagas, Rafael Martinelli","The Electric Time-Dependent Capacitated Arc Routing Problem",2024,"Anais do Simpósio Brasileiro de Pesquisa Operacional","Galoa","https://doi.org/10.59254/sbpo-2024-193662","",140,"2025-09-04 18:47:44","proceedings-article","10.59254/sbpo-2024-193662","2965-1476","",,,,,0,0.00,0,2,1,"","",""
0,"Arsênio Martins Gomes Neto, Maria Eduarda do Egito Xavier, Carolayne de Paula Ferreira Mota, Jônatas Araújo de Almeida","SELEÇÃO DE PLANO DE SAÚDE: UMA ABORDAGEM MULTICRITÉRIO ATRAVÉS DO MÉTODO FITRADEOFF",2024,"Anais do Simpósio Brasileiro de Pesquisa Operacional","Galoa","https://doi.org/10.59254/sbpo-2024-193923","",141,"2025-09-04 18:47:44","proceedings-article","10.59254/sbpo-2024-193923","2965-1476","",,,,,0,0.00,0,4,1,"","",""
0,"Wandry Rodrigues Faria, Ciniro Aparecido Leite Nametala, Benvindo Rodrigues Pereira Junior","Fuse Melting Curve Fitting and Implementation in a Time-Domain Simulation Environment",2024,"Anais do Simpósio Brasileiro de Pesquisa Operacional","Galoa","https://doi.org/10.59254/sbpo-2024-193514","",142,"2025-09-04 18:47:44","proceedings-article","10.59254/sbpo-2024-193514","2965-1476","",,,,,0,0.00,0,3,1,"","",""
0,"Taylon Costa, Thiago Henrique Nogueira, Martín Gómez Ravetti","REINFORCEMENT LEARNING FOR MINING PRODUCTION PLANNING",2024,"Anais do Simpósio Brasileiro de Pesquisa Operacional","Galoa","https://doi.org/10.59254/sbpo-2024-193564","",143,"2025-09-04 18:47:44","proceedings-article","10.59254/sbpo-2024-193564","2965-1476","",,,,,0,0.00,0,3,1,"","",""
0,"Rafael de Castro Silva, Wellington Santos Martins, Leslie Richard Foulds, Humberto Jose Longo","A GRASP heuristic for the maximum-weight planar subgraph problem",2024,"Anais do Simpósio Brasileiro de Pesquisa Operacional","Galoa","https://doi.org/10.59254/sbpo-2024-193597","",144,"2025-09-04 18:47:44","proceedings-article","10.59254/sbpo-2024-193597","2965-1476","",,,,,0,0.00,0,4,1,"","",""
0,"Vitor Oliveira Ropke, Fábio Francisco da Costa Fontes, Daniel Faustino Lacerda de Souza, David Custódio de Sena, Felipe Nascimento Ribeiro","ANÁLISE DO TRANSPORTE PÚBLICO URBANO POR MEIO DA SIMULAÇÃO COMPUTACIONAL DO DESLOCAMENTO DE USUÁRIOS",2024,"Anais do Simpósio Brasileiro de Pesquisa Operacional","Galoa","https://doi.org/10.59254/sbpo-2024-193574","",145,"2025-09-04 18:47:44","proceedings-article","10.59254/sbpo-2024-193574","2965-1476","",,,,,0,0.00,0,5,1,"","",""
0,"Nivanio Jeronimo Bezerra da Silva, Rafaela de Moura Cassiano Silva, Adriana Cavalcante Marques, Mariana Almeida, Ricardo Pires de Souza","APLICAÇÃO DO MÉTODO FITRADEOFF PARA SELEÇÃO DE UMA UNIDADE FEDERATIVA PARA CRIAÇÃO DE UMA BASE DE PESQUISA SOBRE SEGURANÇA PÚBLICA NO BRASIL",2024,"Anais do Simpósio Brasileiro de Pesquisa Operacional","Galoa","https://doi.org/10.59254/sbpo-2024-193567","",146,"2025-09-04 18:47:44","proceedings-article","10.59254/sbpo-2024-193567","2965-1476","",,,,,0,0.00,0,5,1,"","",""
0,"Vivían Sandriny Silva de Andrade, Marina Dantas de Oliveira Duarte","POLÍTICA DE TARIFA ZERO NO TRANSPORTE PÚBLICO URBANO: UMA ANÁLISE FOCADA EM VALOR",2024,"Anais do Simpósio Brasileiro de Pesquisa Operacional","Galoa","https://doi.org/10.59254/sbpo-2024-193548","",147,"2025-09-04 18:47:44","proceedings-article","10.59254/sbpo-2024-193548","2965-1476","",,,,,0,0.00,0,2,1,"","",""
0,"Filipe Pessoa Sousa, Augusto Magalhães Pinto de Mendonça, Igor Machado Coelho, Luiz Satoru Ochi, Cristiane Oliveira de Faria","Técnicas de Inteligência Computacional para Previsão e Mitigação de Eventos Climáticos Hidrológicos Extremos: Uma Revisão Sistemática",2024,"Anais do Simpósio Brasileiro de Pesquisa Operacional","Galoa","https://doi.org/10.59254/sbpo-2024-193442","",148,"2025-09-04 18:47:44","proceedings-article","10.59254/sbpo-2024-193442","2965-1476","",,,,,0,0.00,0,5,1,"","",""
0,"Igor Danilo Costa Matos, Helder Gomes Costa, Marcos Roboredo, Diogo Lima","REFINANDO O MÉTODO PROMETHEE-SCORING ATRAVÉS DE UMA RESTRIÇÃO ADICIONAL DE PONDERAÇÃO",2024,"Anais do Simpósio Brasileiro de Pesquisa Operacional","Galoa","https://doi.org/10.59254/sbpo-2024-193732","",149,"2025-09-04 18:47:44","proceedings-article","10.59254/sbpo-2024-193732","2965-1476","",,,,,0,0.00,0,4,1,"","",""
0,"Felipe Costa Melo Cunha, Ivan Guilhon, Samuel Madeiro, Antônio José da Costa Sampaio, Rudini Sampaio","Spectral Graph Theory and the Normal Modes of Coupled Oscillations",2024,"Anais do Simpósio Brasileiro de Pesquisa Operacional","Galoa","https://doi.org/10.59254/sbpo-2024-193907","",150,"2025-09-04 18:47:44","proceedings-article","10.59254/sbpo-2024-193907","2965-1476","",,,,,0,0.00,0,5,1,"","",""
0,"Mario Viscardi, Sérgio Rebouças, Angelo Passaro","Eficiência do Transporte Aéreo na Amazônia: Reduzindo Custos e Tempo com Pesquisa Operacional",2024,"Anais do Simpósio Brasileiro de Pesquisa Operacional","Galoa","https://doi.org/10.59254/sbpo-2024-193637","",151,"2025-09-04 18:47:44","proceedings-article","10.59254/sbpo-2024-193637","2965-1476","",,,,,0,0.00,0,3,1,"","",""
0,"Alexia Chamone, Helen Vitaline Santos, Laís Gonçalves Viana, Thiago Henrique Nogueira, Larissa Sousa Campos","USO DE MODELAGEM E SIMULAÇÃO PARA OTIMIZAR O ATENDIMENTO EM UMA CLÍNICA DE MEDICINA DO TRABALHO NO ALTO PARANAÍBA",2024,"Anais do Simpósio Brasileiro de Pesquisa Operacional","Galoa","https://doi.org/10.59254/sbpo-2024-193877","",152,"2025-09-04 18:47:44","proceedings-article","10.59254/sbpo-2024-193877","2965-1476","",,,,,0,0.00,0,5,1,"","",""
0,"Gabriela Pinheiro, Luis Antonio Brasil Kowada","Classificação de Candidatas a Pulsar usando SVMs gerados de forma híbrida Clássico-Quântica",2024,"Anais do Simpósio Brasileiro de Pesquisa Operacional","Galoa","https://doi.org/10.59254/sbpo-2024-193639","",153,"2025-09-04 18:47:44","proceedings-article","10.59254/sbpo-2024-193639","2965-1476","",,,,,0,0.00,0,2,1,"","",""
0,"Bryan Brauna, Bonfim Amaro Junior, Guilherme Carvalho","NOVAS VARIAÇÕES DO ALGORITMO GOLDEN BALL COM CHAVES ALEATÓRIAS TENDENCIOSAS: UMA INVESTIGAÇÃO COMPARATIVA APLICADA AO PROBLEMA DO CAIXEIRO VIAJANTE",2024,"Anais do Simpósio Brasileiro de Pesquisa Operacional","Galoa","https://doi.org/10.59254/sbpo-2024-193754","",154,"2025-09-04 18:47:44","proceedings-article","10.59254/sbpo-2024-193754","2965-1476","",,,,,0,0.00,0,3,1,"","",""
0,"Lizete de Paula Ballerini, Eli Angela Vitor Toso","Modelos de otimização multiobjetivo para logística reversa: uma revisão sistemática",2024,"Anais do Simpósio Brasileiro de Pesquisa Operacional","Galoa","https://doi.org/10.59254/sbpo-2024-193648","",155,"2025-09-04 18:47:44","proceedings-article","10.59254/sbpo-2024-193648","2965-1476","",,,,,0,0.00,0,2,1,"","",""
0,"Arthur Pinheiro de Araújo Costa, Ronaldo Ribeiro Goldschmidt, Marcos Santos","Operações de vigilância e monitoramento no apoio a desastres naturais: integrando Aprendizado de Máquina e Apoio Multicritério à Decisão por meio do método CROWM",2024,"Anais do Simpósio Brasileiro de Pesquisa Operacional","Galoa","https://doi.org/10.59254/sbpo-2024-193885","",156,"2025-09-04 18:47:44","proceedings-article","10.59254/sbpo-2024-193885","2965-1476","",,,,,0,0.00,0,3,1,"","",""
0,"Oscar dos Santos Esgalha, Fábio Luiz Usberti, Celso Cavellucci","Formulation and heuristic for the container image reconstruction problem",2024,"Anais do Simpósio Brasileiro de Pesquisa Operacional","Galoa","https://doi.org/10.59254/sbpo-2024-193609","",157,"2025-09-04 18:47:44","proceedings-article","10.59254/sbpo-2024-193609","2965-1476","",,,,,0,0.00,0,3,1,"","",""
0,"José Geraldo Vidal Vieira","MULTICRITERIA DECISION-BASED APPROACH FOR RESOURCE ALLOCATION PROBLEMS IN SLUM AREAS",2024,"Anais do Simpósio Brasileiro de Pesquisa Operacional","Galoa","https://doi.org/10.59254/sbpo-2024-193558","",158,"2025-09-04 18:47:44","proceedings-article","10.59254/sbpo-2024-193558","2965-1476","",,,,,0,0.00,0,1,1,"","",""
0,"Israel Pereira de Souza, Igor Machado Coelho, Luiz Satoru Ochi","DIFFERENTIAL EVOLUTION FOR GRAPH COLORING PROBLEM",2024,"Anais do Simpósio Brasileiro de Pesquisa Operacional","Galoa","https://doi.org/10.59254/sbpo-2024-193324","",159,"2025-09-04 18:47:44","proceedings-article","10.59254/sbpo-2024-193324","2965-1476","",,,,,0,0.00,0,3,1,"","",""
0,"Evellyn Soares Cavalcante, Vinicius F. dos Santos, Sebastián Urrutia","UM MODELO COMPACTO PARA O PROBLEMA DO NÚMERO DE SALTOS ARBÓREOS DE UMA ORDEM PARCIAL",2024,"Anais do Simpósio Brasileiro de Pesquisa Operacional","Galoa","https://doi.org/10.59254/sbpo-2024-193369","",160,"2025-09-04 18:47:44","proceedings-article","10.59254/sbpo-2024-193369","2965-1476","",,,,,0,0.00,0,3,1,"","",""
0,"Caio Oliveira Lopes, Mayron César de Oliveira Moreira","Uma análise experimental de modelos matemáticos para a resolução do planejamento de rotação de tarefas em linhas de produção com trabalhadores heterogêneos",2024,"Anais do Simpósio Brasileiro de Pesquisa Operacional","Galoa","https://doi.org/10.59254/sbpo-2024-193813","",161,"2025-09-04 18:47:44","proceedings-article","10.59254/sbpo-2024-193813","2965-1476","",,,,,0,0.00,0,2,1,"","",""
0,"Henri Makika, Romis Ribeiro de Faissol Attux, João Marcos Travassos Romano","Comitê de Máquinas Heterogêneas e Redes Transformers na Previsão de Preços de Commodities: Evidências Empíricas",2024,"Anais do Simpósio Brasileiro de Pesquisa Operacional","Galoa","https://doi.org/10.59254/sbpo-2024-193665","",162,"2025-09-04 18:47:44","proceedings-article","10.59254/sbpo-2024-193665","2965-1476","",,,,,0,0.00,0,3,1,"","",""
0,"Filipe Eringer Garruth, Leandro Resendo","MODELO EXATO PARA O PROBLEMA DA GRADE DE HORÁRIO ESCOLAR CONSIDERANDO CUSTO PEDAGÓGICO E PREFERÊNCIAS DOCENTES: REALIDADE DOS INSTITUTOS FEDERAIS",2024,"Anais do Simpósio Brasileiro de Pesquisa Operacional","Galoa","https://doi.org/10.59254/sbpo-2024-193641","",163,"2025-09-04 18:47:44","proceedings-article","10.59254/sbpo-2024-193641","2965-1476","",,,,,0,0.00,0,2,1,"","",""
0,"Richard Sidney de Souza e Silva, Carlos Thassius Ferreira Freire, Emanuel Eduardo Oliveira Dionisio, Thiago Gouveia","Otimização do modelo de Esteganografia LSB em imagens utilizando Algoritmo de Colônia de Formigas",2024,"Anais do Simpósio Brasileiro de Pesquisa Operacional","Galoa","https://doi.org/10.59254/sbpo-2024-193420","",164,"2025-09-04 18:47:44","proceedings-article","10.59254/sbpo-2024-193420","2965-1476","",,,,,0,0.00,0,4,1,"","",""
0,"Maria Elvira Piñeiro Maceira, Albert Melo, Roberto Pereira Caldas, José Francisco M. Pessanha","DETERMINAÇÃO DE FUNÇÕES DE TRANSFERÊNCIAS MENSAIS ENTRE VELOCIDADES DO VENTO E PRODUÇÃO DE ENERGIA EÓLICA NO ALGORITMO DE PDDE",2024,"Anais do Simpósio Brasileiro de Pesquisa Operacional","Galoa","https://doi.org/10.59254/sbpo-2024-193328","",165,"2025-09-04 18:47:44","proceedings-article","10.59254/sbpo-2024-193328","2965-1476","",,,,,0,0.00,0,4,1,"","",""
0,"Diogo Lopes Bragança, Andre Abel Augusto, Julio Cesar Stacchini de Souza, Rainer Zanghi","Planejamento de Sistemas de Medição Utilizando Teoria da Informação",2024,"Anais do Simpósio Brasileiro de Pesquisa Operacional","Galoa","https://doi.org/10.59254/sbpo-2024-193615","",166,"2025-09-04 18:47:44","proceedings-article","10.59254/sbpo-2024-193615","2965-1476","",,,,,0,0.00,0,4,1,"","",""
0,"Duan Vilela Ferreira, Vinícius de Oliveira, Tarso Vilela Ferreira, Ana Paula Gusmão","APLICAÇÃO DO FITRADEOFF PARA PRIORIZAÇÃO DE AÇÕES NO COMBATE ÀS PERDAS COMERCIAIS DO SETOR ELÉTRICO",2024,"Anais do Simpósio Brasileiro de Pesquisa Operacional","Galoa","https://doi.org/10.59254/sbpo-2024-193810","",167,"2025-09-04 18:47:44","proceedings-article","10.59254/sbpo-2024-193810","2965-1476","",,,,,0,0.00,0,4,1,"","",""
0,"Mariana Chaves Reis, Paulo Ivo Braga de Queiroz","A review on the optimization methods applied to simulation-based building performance analysis",2024,"Anais do Simpósio Brasileiro de Pesquisa Operacional","Galoa","https://doi.org/10.59254/sbpo-2024-193443","",168,"2025-09-04 18:47:44","proceedings-article","10.59254/sbpo-2024-193443","2965-1476","",,,,,0,0.00,0,2,1,"","",""
0,"Gustavo Delazeri, Marcus Ritt","A General Model for Wildfire Suppression Problems",2024,"Anais do Simpósio Brasileiro de Pesquisa Operacional","Galoa","https://doi.org/10.59254/sbpo-2024-193493","",169,"2025-09-04 18:47:44","proceedings-article","10.59254/sbpo-2024-193493","2965-1476","",,,,,0,0.00,0,2,1,"","",""
0,"Glaucia Pissinelli, Leonardo Tomazeli Duarte, Yannick Deville","Uma Análise Comparativa entre o Modelo de Agregação Linear e a Integral de Choquet considerando o Número de Ordenamentos Atingíveis no Contexto de Apoio à Decisão Multicritério",2024,"Anais do Simpósio Brasileiro de Pesquisa Operacional","Galoa","https://doi.org/10.59254/sbpo-2024-193467","",170,"2025-09-04 18:47:44","proceedings-article","10.59254/sbpo-2024-193467","2965-1476","",,,,,0,0.00,0,3,1,"","",""
0,"Carlos Romaniello, Bárbara Letícia Rodrigues Milagres, Pedro Henrique Lopes Silva","UMA ABORDAGEM MULTI-OBJETIVO DO PROBLEMA DE ALOCAÇÃO DE SALAS DE AULA",2024,"Anais do Simpósio Brasileiro de Pesquisa Operacional","Galoa","https://doi.org/10.59254/sbpo-2024-193484","",171,"2025-09-04 18:47:44","proceedings-article","10.59254/sbpo-2024-193484","2965-1476","",,,,,0,0.00,0,3,1,"","",""
